E_nX	E_X	C_nX	C_X
{Prep} the car , the tree burned and shook {Conn} the tree burned.	{Prep} the car , the tree burned and shook {Conn} the tree shook.	{Prep} the car , the tree burned and shook {Conn} the car burned.	{Prep} the car , the tree burned and shook {Conn} the car shook.
{Prep} the tree , the car burned and shook {Conn} the car burned.	{Prep} the tree , the car burned and shook {Conn} the car shook.	{Prep} the tree , the car burned and shook {Conn} the tree burned.	{Prep} the tree , the car burned and shook {Conn} the tree shook.
{Prep} the car , the tree shook and burned {Conn} the tree shook.	{Prep} the car , the tree shook and burned {Conn} the tree burned.	{Prep} the car , the tree shook and burned {Conn} the car shook.	{Prep} the car , the tree shook and burned {Conn} the car burned.
{Prep} the tree , the car shook and burned {Conn} the car shook.	{Prep} the tree , the car shook and burned {Conn} the car burned.	{Prep} the tree , the car shook and burned {Conn} the tree shook.	{Prep} the tree , the car shook and burned {Conn} the tree burned.
{Prep} the grandma , the girl smiled and laughed {Conn} the girl smiled.	{Prep} the grandma , the girl smiled and laughed {Conn} the girl laughed.	{Prep} the grandma , the girl smiled and laughed {Conn} the grandma smiled.	{Prep} the grandma , the girl smiled and laughed {Conn} the grandma laughed.
{Prep} the girl , the grandma smiled and laughed {Conn} the grandma smiled.	{Prep} the girl , the grandma smiled and laughed {Conn} the grandma laughed.	{Prep} the girl , the grandma smiled and laughed {Conn} the girl smiled.	{Prep} the girl , the grandma smiled and laughed {Conn} the girl laughed.
{Prep} the grandma , the girl laughed and smiled {Conn} the girl laughed.	{Prep} the grandma , the girl laughed and smiled {Conn} the girl smiled.	{Prep} the grandma , the girl laughed and smiled {Conn} the grandma laughed.	{Prep} the grandma , the girl laughed and smiled {Conn} the grandma smiled.
{Prep} the girl , the grandma laughed and smiled {Conn} the grandma laughed.	{Prep} the girl , the grandma laughed and smiled {Conn} the grandma smiled.	{Prep} the girl , the grandma laughed and smiled {Conn} the girl laughed.	{Prep} the girl , the grandma laughed and smiled {Conn} the girl smiled.
{Prep} the dog , the cat jumped and hid {Conn} the cat jumped.	{Prep} the dog , the cat jumped and hid {Conn} the cat hid.	{Prep} the dog , the cat jumped and hid {Conn} the dog jumped.	{Prep} the dog , the cat jumped and hid {Conn} the dog hid.
{Prep} the cat , the dog jumped and hid {Conn} the dog jumped.	{Prep} the cat , the dog jumped and hid {Conn} the dog hid.	{Prep} the cat , the dog jumped and hid {Conn} the cat jumped.	{Prep} the cat , the dog jumped and hid {Conn} the cat hid.
{Prep} the dog , the cat hid and jumped {Conn} the cat hid.	{Prep} the dog , the cat hid and jumped {Conn} the cat jumped.	{Prep} the dog , the cat hid and jumped {Conn} the dog hid.	{Prep} the dog , the cat hid and jumped {Conn} the dog jumped.
{Prep} the cat , the dog hid and jumped {Conn} the dog hid.	{Prep} the cat , the dog hid and jumped {Conn} the dog jumped.	{Prep} the cat , the dog hid and jumped {Conn} the cat hid.	{Prep} the cat , the dog hid and jumped {Conn} the cat jumped.
{Prep} the lion , the tiger growled and yawned {Conn} the tiger growled.	{Prep} the lion , the tiger growled and yawned {Conn} the tiger yawned.	{Prep} the lion , the tiger growled and yawned {Conn} the lion growled.	{Prep} the lion , the tiger growled and yawned {Conn} the lion yawned.
{Prep} the tiger , the lion growled and yawned {Conn} the lion growled.	{Prep} the tiger , the lion growled and yawned {Conn} the lion yawned.	{Prep} the tiger , the lion growled and yawned {Conn} the tiger growled.	{Prep} the tiger , the lion growled and yawned {Conn} the tiger yawned.
{Prep} the lion , the tiger yawned and growled {Conn} the tiger yawned.	{Prep} the lion , the tiger yawned and growled {Conn} the tiger growled.	{Prep} the lion , the tiger yawned and growled {Conn} the lion yawned.	{Prep} the lion , the tiger yawned and growled {Conn} the lion growled.
{Prep} the tiger , the lion yawned and growled {Conn} the lion yawned.	{Prep} the tiger , the lion yawned and growled {Conn} the lion growled.	{Prep} the tiger , the lion yawned and growled {Conn} the tiger yawned.	{Prep} the tiger , the lion yawned and growled {Conn} the tiger growled.
{Prep} the doctor , the patient sat and blinked {Conn} the patient sat.	{Prep} the doctor , the patient sat and blinked {Conn} the patient blinked.	{Prep} the doctor , the patient sat and blinked {Conn} the doctor sat.	{Prep} the doctor , the patient sat and blinked {Conn} the doctor blinked.
{Prep} the patient , the doctor sat and blinked {Conn} the doctor sat.	{Prep} the patient , the doctor sat and blinked {Conn} the doctor blinked.	{Prep} the patient , the doctor sat and blinked {Conn} the patient sat.	{Prep} the patient , the doctor sat and blinked {Conn} the patient blinked.
{Prep} the doctor , the patient blinked and sat {Conn} the patient blinked.	{Prep} the doctor , the patient blinked and sat {Conn} the patient sat.	{Prep} the doctor , the patient blinked and sat {Conn} the doctor blinked.	{Prep} the doctor , the patient blinked and sat {Conn} the doctor sat.
{Prep} the patient , the doctor blinked and sat {Conn} the doctor blinked.	{Prep} the patient , the doctor blinked and sat {Conn} the doctor sat.	{Prep} the patient , the doctor blinked and sat {Conn} the patient blinked.	{Prep} the patient , the doctor blinked and sat {Conn} the patient sat.
{Prep} the President , the beaurocrat contemplated and tweeted {Conn} the beaurocrat contemplated.	{Prep} the President , the beaurocrat contemplated and tweeted {Conn} the beaurocrat tweeted.	{Prep} the President , the beaurocrat contemplated and tweeted {Conn} the President contemplated.	{Prep} the President , the beaurocrat contemplated and tweeted {Conn} the President tweeted.
{Prep} the beaurocrat , the President contemplated and tweeted {Conn} the President contemplated.	{Prep} the beaurocrat , the President contemplated and tweeted {Conn} the President tweeted.	{Prep} the beaurocrat , the President contemplated and tweeted {Conn} the beaurocrat contemplated.	{Prep} the beaurocrat , the President contemplated and tweeted {Conn} the beaurocrat tweeted.
{Prep} the President , the beaurocrat tweeted and contemplated {Conn} the beaurocrat tweeted.	{Prep} the President , the beaurocrat tweeted and contemplated {Conn} the beaurocrat contemplated.	{Prep} the President , the beaurocrat tweeted and contemplated {Conn} the President tweeted.	{Prep} the President , the beaurocrat tweeted and contemplated {Conn} the President contemplated.
{Prep} the beaurocrat , the President tweeted and contemplated {Conn} the President tweeted.	{Prep} the beaurocrat , the President tweeted and contemplated {Conn} the President contemplated.	{Prep} the beaurocrat , the President tweeted and contemplated {Conn} the beaurocrat tweeted.	{Prep} the beaurocrat , the President tweeted and contemplated {Conn} the beaurocrat contemplated.
{Prep} the bride , the priest shouted and frowned {Conn} the priest shouted.	{Prep} the bride , the priest shouted and frowned {Conn} the priest frowned.	{Prep} the bride , the priest shouted and frowned {Conn} the bride shouted.	{Prep} the bride , the priest shouted and frowned {Conn} the bride frowned.
{Prep} the priest , the bride shouted and frowned {Conn} the bride shouted.	{Prep} the priest , the bride shouted and frowned {Conn} the bride frowned.	{Prep} the priest , the bride shouted and frowned {Conn} the priest shouted.	{Prep} the priest , the bride shouted and frowned {Conn} the priest frowned.
{Prep} the bride , the priest frowned and shouted {Conn} the priest frowned.	{Prep} the bride , the priest frowned and shouted {Conn} the priest shouted.	{Prep} the bride , the priest frowned and shouted {Conn} the bride frowned.	{Prep} the bride , the priest frowned and shouted {Conn} the bride shouted.
{Prep} the priest , the bride frowned and shouted {Conn} the bride frowned.	{Prep} the priest , the bride frowned and shouted {Conn} the bride shouted.	{Prep} the priest , the bride frowned and shouted {Conn} the priest frowned.	{Prep} the priest , the bride frowned and shouted {Conn} the priest shouted.
{Prep} the bee , the flower sang and wriggled {Conn} the flower sang.	{Prep} the bee , the flower sang and wriggled {Conn} the flower wriggled.	{Prep} the bee , the flower sang and wriggled {Conn} the bee sang.	{Prep} the bee , the flower sang and wriggled {Conn} the bee wriggled.
{Prep} the flower , the bee sang and wriggled {Conn} the bee sang.	{Prep} the flower , the bee sang and wriggled {Conn} the bee wriggled.	{Prep} the flower , the bee sang and wriggled {Conn} the flower sang.	{Prep} the flower , the bee sang and wriggled {Conn} the flower wriggled.
{Prep} the bee , the flower wriggled and sang {Conn} the flower wriggled.	{Prep} the bee , the flower wriggled and sang {Conn} the flower sang.	{Prep} the bee , the flower wriggled and sang {Conn} the bee wriggled.	{Prep} the bee , the flower wriggled and sang {Conn} the bee sang.
{Prep} the flower , the bee wriggled and sang {Conn} the bee wriggled.	{Prep} the flower , the bee wriggled and sang {Conn} the bee sang.	{Prep} the flower , the bee wriggled and sang {Conn} the flower wriggled.	{Prep} the flower , the bee wriggled and sang {Conn} the flower sang.
{Prep} the baby , the nurse slept and cried {Conn} the nurse slept.	{Prep} the baby , the nurse slept and cried {Conn} the nurse cried.	{Prep} the baby , the nurse slept and cried {Conn} the baby slept.	{Prep} the baby , the nurse slept and cried {Conn} the baby cried.
{Prep} the nurse , the baby slept and cried {Conn} the baby slept.	{Prep} the nurse , the baby slept and cried {Conn} the baby cried.	{Prep} the nurse , the baby slept and cried {Conn} the nurse slept.	{Prep} the nurse , the baby slept and cried {Conn} the nurse cried.
{Prep} the baby , the nurse cried and slept {Conn} the nurse cried.	{Prep} the baby , the nurse cried and slept {Conn} the nurse slept.	{Prep} the baby , the nurse cried and slept {Conn} the baby cried.	{Prep} the baby , the nurse cried and slept {Conn} the baby slept.
{Prep} the nurse , the baby cried and slept {Conn} the baby cried.	{Prep} the nurse , the baby cried and slept {Conn} the baby slept.	{Prep} the nurse , the baby cried and slept {Conn} the nurse cried.	{Prep} the nurse , the baby cried and slept {Conn} the nurse slept.
{Prep} the virus , the antibodies emerged and dwindled {Conn} the antibodies emerged.	{Prep} the virus , the antibodies emerged and dwindled {Conn} the antibodies dwindled.	{Prep} the virus , the antibodies emerged and dwindled {Conn} the virus emerged.	{Prep} the virus , the antibodies emerged and dwindled {Conn} the virus dwindled.
{Prep} the antibodies , the virus emerged and dwindled {Conn} the virus emerged.	{Prep} the antibodies , the virus emerged and dwindled {Conn} the virus dwindled.	{Prep} the antibodies , the virus emerged and dwindled {Conn} the antibodies emerged.	{Prep} the antibodies , the virus emerged and dwindled {Conn} the antibodies dwindled.
{Prep} the virus , the antibodies dwindled and emerged {Conn} the antibodies dwindled.	{Prep} the virus , the antibodies dwindled and emerged {Conn} the antibodies emerged.	{Prep} the virus , the antibodies dwindled and emerged {Conn} the virus dwindled.	{Prep} the virus , the antibodies dwindled and emerged {Conn} the virus emerged.
{Prep} the antibodies , the virus dwindled and emerged {Conn} the virus dwindled.	{Prep} the antibodies , the virus dwindled and emerged {Conn} the virus emerged.	{Prep} the antibodies , the virus dwindled and emerged {Conn} the antibodies dwindled.	{Prep} the antibodies , the virus dwindled and emerged {Conn} the antibodies emerged.
{Prep} the chef , the octopus vanished and gasped {Conn} the octopus vanished.	{Prep} the chef , the octopus vanished and gasped {Conn} the octopus gasped.	{Prep} the chef , the octopus vanished and gasped {Conn} the chef vanished.	{Prep} the chef , the octopus vanished and gasped {Conn} the chef gasped.
{Prep} the octopus , the chef vanished and gasped {Conn} the chef vanished.	{Prep} the octopus , the chef vanished and gasped {Conn} the chef gasped.	{Prep} the octopus , the chef vanished and gasped {Conn} the octopus vanished.	{Prep} the octopus , the chef vanished and gasped {Conn} the octopus gasped.
{Prep} the chef , the octopus gasped and vanished {Conn} the octopus gasped.	{Prep} the chef , the octopus gasped and vanished {Conn} the octopus vanished.	{Prep} the chef , the octopus gasped and vanished {Conn} the chef gasped.	{Prep} the chef , the octopus gasped and vanished {Conn} the chef vanished.
{Prep} the octopus , the chef gasped and vanished {Conn} the chef gasped.	{Prep} the octopus , the chef gasped and vanished {Conn} the chef vanished.	{Prep} the octopus , the chef gasped and vanished {Conn} the octopus gasped.	{Prep} the octopus , the chef gasped and vanished {Conn} the octopus vanished.
{Prep} the journalist , the senator wrote and fumed {Conn} the senator wrote.	{Prep} the journalist , the senator wrote and fumed {Conn} the senator fumed.	{Prep} the journalist , the senator wrote and fumed {Conn} the journalist wrote.	{Prep} the journalist , the senator wrote and fumed {Conn} the journalist fumed.
{Prep} the senator , the journalist wrote and fumed {Conn} the journalist wrote.	{Prep} the senator , the journalist wrote and fumed {Conn} the journalist fumed.	{Prep} the senator , the journalist wrote and fumed {Conn} the senator wrote.	{Prep} the senator , the journalist wrote and fumed {Conn} the senator fumed.
{Prep} the journalist , the senator fumed and wrote {Conn} the senator fumed.	{Prep} the journalist , the senator fumed and wrote {Conn} the senator wrote.	{Prep} the journalist , the senator fumed and wrote {Conn} the journalist fumed.	{Prep} the journalist , the senator fumed and wrote {Conn} the journalist wrote.
{Prep} the senator , the journalist fumed and wrote {Conn} the journalist fumed.	{Prep} the senator , the journalist fumed and wrote {Conn} the journalist wrote.	{Prep} the senator , the journalist fumed and wrote {Conn} the senator fumed.	{Prep} the senator , the journalist fumed and wrote {Conn} the senator wrote.
{Prep} the ant , the grasshopper worked and played {Conn} the grasshopper worked.	{Prep} the ant , the grasshopper worked and played {Conn} the grasshopper played.	{Prep} the ant , the grasshopper worked and played {Conn} the ant worked.	{Prep} the ant , the grasshopper worked and played {Conn} the ant played.
{Prep} the grasshopper , the ant worked and played {Conn} the ant worked.	{Prep} the grasshopper , the ant worked and played {Conn} the ant played.	{Prep} the grasshopper , the ant worked and played {Conn} the grasshopper worked.	{Prep} the grasshopper , the ant worked and played {Conn} the grasshopper played.
{Prep} the ant , the grasshopper played and worked {Conn} the grasshopper played.	{Prep} the ant , the grasshopper played and worked {Conn} the grasshopper worked.	{Prep} the ant , the grasshopper played and worked {Conn} the ant played.	{Prep} the ant , the grasshopper played and worked {Conn} the ant worked.
{Prep} the grasshopper , the ant played and worked {Conn} the ant played.	{Prep} the grasshopper , the ant played and worked {Conn} the ant worked.	{Prep} the grasshopper , the ant played and worked {Conn} the grasshopper played.	{Prep} the grasshopper , the ant played and worked {Conn} the grasshopper worked.
{Prep} the princess , the witch melted and rejoiced {Conn} the witch melted.	{Prep} the princess , the witch melted and rejoiced {Conn} the witch rejoiced.	{Prep} the princess , the witch melted and rejoiced {Conn} the princess melted.	{Prep} the princess , the witch melted and rejoiced {Conn} the princess rejoiced.
{Prep} the witch , the princess melted and rejoiced {Conn} the princess melted.	{Prep} the witch , the princess melted and rejoiced {Conn} the princess rejoiced.	{Prep} the witch , the princess melted and rejoiced {Conn} the witch melted.	{Prep} the witch , the princess melted and rejoiced {Conn} the witch rejoiced.
{Prep} the princess , the witch rejoiced and melted {Conn} the witch rejoiced.	{Prep} the princess , the witch rejoiced and melted {Conn} the witch melted.	{Prep} the princess , the witch rejoiced and melted {Conn} the princess rejoiced.	{Prep} the princess , the witch rejoiced and melted {Conn} the princess melted.
{Prep} the witch , the princess rejoiced and melted {Conn} the princess rejoiced.	{Prep} the witch , the princess rejoiced and melted {Conn} the princess melted.	{Prep} the witch , the princess rejoiced and melted {Conn} the witch rejoiced.	{Prep} the witch , the princess rejoiced and melted {Conn} the witch melted.
{Prep} the fish , the turtle learned and failed {Conn} the turtle learned.	{Prep} the fish , the turtle learned and failed {Conn} the turtle failed.	{Prep} the fish , the turtle learned and failed {Conn} the fish learned.	{Prep} the fish , the turtle learned and failed {Conn} the fish failed.
{Prep} the turtle , the fish learned and failed {Conn} the fish learned.	{Prep} the turtle , the fish learned and failed {Conn} the fish failed.	{Prep} the turtle , the fish learned and failed {Conn} the turtle learned.	{Prep} the turtle , the fish learned and failed {Conn} the turtle failed.
{Prep} the fish , the turtle failed and learned {Conn} the turtle failed.	{Prep} the fish , the turtle failed and learned {Conn} the turtle learned.	{Prep} the fish , the turtle failed and learned {Conn} the fish failed.	{Prep} the fish , the turtle failed and learned {Conn} the fish learned.
{Prep} the turtle , the fish failed and learned {Conn} the fish failed.	{Prep} the turtle , the fish failed and learned {Conn} the fish learned.	{Prep} the turtle , the fish failed and learned {Conn} the turtle failed.	{Prep} the turtle , the fish failed and learned {Conn} the turtle learned.
{Prep} the king , the jester juggled and sang {Conn} the jester juggled.	{Prep} the king , the jester juggled and sang {Conn} the jester sang.	{Prep} the king , the jester juggled and sang {Conn} the king juggled.	{Prep} the king , the jester juggled and sang {Conn} the king sang.
{Prep} the jester , the king juggled and sang {Conn} the king juggled.	{Prep} the jester , the king juggled and sang {Conn} the king sang.	{Prep} the jester , the king juggled and sang {Conn} the jester juggled.	{Prep} the jester , the king juggled and sang {Conn} the jester sang.
{Prep} the king , the jester sang and juggled {Conn} the jester sang.	{Prep} the king , the jester sang and juggled {Conn} the jester juggled.	{Prep} the king , the jester sang and juggled {Conn} the king sang.	{Prep} the king , the jester sang and juggled {Conn} the king juggled.
{Prep} the jester , the king sang and juggled {Conn} the king sang.	{Prep} the jester , the king sang and juggled {Conn} the king juggled.	{Prep} the jester , the king sang and juggled {Conn} the jester sang.	{Prep} the jester , the king sang and juggled {Conn} the jester juggled.
{Prep} the poet , the dandelion swayed and breathed {Conn} the dandelion swayed.	{Prep} the poet , the dandelion swayed and breathed {Conn} the dandelion breathed.	{Prep} the poet , the dandelion swayed and breathed {Conn} the poet swayed.	{Prep} the poet , the dandelion swayed and breathed {Conn} the poet breathed.
{Prep} the dandelion , the poet swayed and breathed {Conn} the poet swayed.	{Prep} the dandelion , the poet swayed and breathed {Conn} the poet breathed.	{Prep} the dandelion , the poet swayed and breathed {Conn} the dandelion swayed.	{Prep} the dandelion , the poet swayed and breathed {Conn} the dandelion breathed.
{Prep} the poet , the dandelion breathed and swayed {Conn} the dandelion breathed.	{Prep} the poet , the dandelion breathed and swayed {Conn} the dandelion swayed.	{Prep} the poet , the dandelion breathed and swayed {Conn} the poet breathed.	{Prep} the poet , the dandelion breathed and swayed {Conn} the poet swayed.
{Prep} the dandelion , the poet breathed and swayed {Conn} the poet breathed.	{Prep} the dandelion , the poet breathed and swayed {Conn} the poet swayed.	{Prep} the dandelion , the poet breathed and swayed {Conn} the dandelion breathed.	{Prep} the dandelion , the poet breathed and swayed {Conn} the dandelion swayed.
{Prep} the worker , the boss resigned and apologized {Conn} the boss resigned.	{Prep} the worker , the boss resigned and apologized {Conn} the boss apologized.	{Prep} the worker , the boss resigned and apologized {Conn} the worker resigned.	{Prep} the worker , the boss resigned and apologized {Conn} the worker apologized.
{Prep} the boss , the worker resigned and apologized {Conn} the worker resigned.	{Prep} the boss , the worker resigned and apologized {Conn} the worker apologized.	{Prep} the boss , the worker resigned and apologized {Conn} the boss resigned.	{Prep} the boss , the worker resigned and apologized {Conn} the boss apologized.
{Prep} the worker , the boss apologized and resigned {Conn} the boss apologized.	{Prep} the worker , the boss apologized and resigned {Conn} the boss resigned.	{Prep} the worker , the boss apologized and resigned {Conn} the worker apologized.	{Prep} the worker , the boss apologized and resigned {Conn} the worker resigned.
{Prep} the boss , the worker apologized and resigned {Conn} the worker apologized.	{Prep} the boss , the worker apologized and resigned {Conn} the worker resigned.	{Prep} the boss , the worker apologized and resigned {Conn} the boss apologized.	{Prep} the boss , the worker apologized and resigned {Conn} the boss resigned.
{Prep} the magician , the bunny disappeared and observed {Conn} the bunny disappeared.	{Prep} the magician , the bunny disappeared and observed {Conn} the bunny observed.	{Prep} the magician , the bunny disappeared and observed {Conn} the magician disappeared.	{Prep} the magician , the bunny disappeared and observed {Conn} the magician observed.
{Prep} the bunny , the magician disappeared and observed {Conn} the magician disappeared.	{Prep} the bunny , the magician disappeared and observed {Conn} the magician observed.	{Prep} the bunny , the magician disappeared and observed {Conn} the bunny disappeared.	{Prep} the bunny , the magician disappeared and observed {Conn} the bunny observed.
{Prep} the magician , the bunny observed and disappeared {Conn} the bunny observed.	{Prep} the magician , the bunny observed and disappeared {Conn} the bunny disappeared.	{Prep} the magician , the bunny observed and disappeared {Conn} the magician observed.	{Prep} the magician , the bunny observed and disappeared {Conn} the magician disappeared.
{Prep} the bunny , the magician observed and disappeared {Conn} the magician observed.	{Prep} the bunny , the magician observed and disappeared {Conn} the magician disappeared.	{Prep} the bunny , the magician observed and disappeared {Conn} the bunny observed.	{Prep} the bunny , the magician observed and disappeared {Conn} the bunny disappeared.
{Prep} the dragon , the child apologized and flew {Conn} the child apologized.	{Prep} the dragon , the child apologized and flew {Conn} the child flew.	{Prep} the dragon , the child apologized and flew {Conn} the dragon apologized.	{Prep} the dragon , the child apologized and flew {Conn} the dragon flew.
{Prep} the child , the dragon apologized and flew {Conn} the dragon apologized.	{Prep} the child , the dragon apologized and flew {Conn} the dragon flew.	{Prep} the child , the dragon apologized and flew {Conn} the child apologized.	{Prep} the child , the dragon apologized and flew {Conn} the child flew.
{Prep} the dragon , the child flew and apologized {Conn} the child flew.	{Prep} the dragon , the child flew and apologized {Conn} the child apologized.	{Prep} the dragon , the child flew and apologized {Conn} the dragon flew.	{Prep} the dragon , the child flew and apologized {Conn} the dragon apologized.
{Prep} the child , the dragon flew and apologized {Conn} the dragon flew.	{Prep} the child , the dragon flew and apologized {Conn} the dragon apologized.	{Prep} the child , the dragon flew and apologized {Conn} the child flew.	{Prep} the child , the dragon flew and apologized {Conn} the child apologized.
{Prep} the comedian , the audience bombed and aged {Conn} the audience bombed.	{Prep} the comedian , the audience bombed and aged {Conn} the audience aged.	{Prep} the comedian , the audience bombed and aged {Conn} the comedian bombed.	{Prep} the comedian , the audience bombed and aged {Conn} the comedian aged.
{Prep} the audience , the comedian bombed and aged {Conn} the comedian bombed.	{Prep} the audience , the comedian bombed and aged {Conn} the comedian aged.	{Prep} the audience , the comedian bombed and aged {Conn} the audience bombed.	{Prep} the audience , the comedian bombed and aged {Conn} the audience aged.
{Prep} the comedian , the audience aged and bombed {Conn} the audience aged.	{Prep} the comedian , the audience aged and bombed {Conn} the audience bombed.	{Prep} the comedian , the audience aged and bombed {Conn} the comedian aged.	{Prep} the comedian , the audience aged and bombed {Conn} the comedian bombed.
{Prep} the audience , the comedian aged and bombed {Conn} the comedian aged.	{Prep} the audience , the comedian aged and bombed {Conn} the comedian bombed.	{Prep} the audience , the comedian aged and bombed {Conn} the audience aged.	{Prep} the audience , the comedian aged and bombed {Conn} the audience bombed.
{Prep} the therapist , the insurer refused and screamed {Conn} the insurer refused.	{Prep} the therapist , the insurer refused and screamed {Conn} the insurer screamed.	{Prep} the therapist , the insurer refused and screamed {Conn} the therapist refused.	{Prep} the therapist , the insurer refused and screamed {Conn} the therapist screamed.
