E_nX	E_X	C_nX	C_X
{Prep} the insurer , the therapist refused and screamed {Conn} the therapist refused.	{Prep} the insurer , the therapist refused and screamed {Conn} the therapist screamed.	{Prep} the insurer , the therapist refused and screamed {Conn} the insurer refused.	{Prep} the insurer , the therapist refused and screamed {Conn} the insurer screamed.
{Prep} the therapist , the insurer screamed and refused {Conn} the insurer screamed.	{Prep} the therapist , the insurer screamed and refused {Conn} the insurer refused.	{Prep} the therapist , the insurer screamed and refused {Conn} the therapist screamed.	{Prep} the therapist , the insurer screamed and refused {Conn} the therapist refused.
{Prep} the insurer , the therapist screamed and refused {Conn} the therapist screamed.	{Prep} the insurer , the therapist screamed and refused {Conn} the therapist refused.	{Prep} the insurer , the therapist screamed and refused {Conn} the insurer screamed.	{Prep} the insurer , the therapist screamed and refused {Conn} the insurer refused.
{Prep} the shoes , the carpet shone and deteriorated {Conn} the carpet shone.	{Prep} the shoes , the carpet shone and deteriorated {Conn} the carpet deteriorated.	{Prep} the shoes , the carpet shone and deteriorated {Conn} the shoes shone.	{Prep} the shoes , the carpet shone and deteriorated {Conn} the shoes deteriorated.
{Prep} the carpet , the shoes shone and deteriorated {Conn} the shoes shone.	{Prep} the carpet , the shoes shone and deteriorated {Conn} the shoes deteriorated.	{Prep} the carpet , the shoes shone and deteriorated {Conn} the carpet shone.	{Prep} the carpet , the shoes shone and deteriorated {Conn} the carpet deteriorated.
{Prep} the shoes , the carpet deteriorated and shone {Conn} the carpet deteriorated.	{Prep} the shoes , the carpet deteriorated and shone {Conn} the carpet shone.	{Prep} the shoes , the carpet deteriorated and shone {Conn} the shoes deteriorated.	{Prep} the shoes , the carpet deteriorated and shone {Conn} the shoes shone.
{Prep} the carpet , the shoes deteriorated and shone {Conn} the shoes deteriorated.	{Prep} the carpet , the shoes deteriorated and shone {Conn} the shoes shone.	{Prep} the carpet , the shoes deteriorated and shone {Conn} the carpet deteriorated.	{Prep} the carpet , the shoes deteriorated and shone {Conn} the carpet shone.
{Prep} the principal , the student smiled and frowned {Conn} the student smiled.	{Prep} the principal , the student smiled and frowned {Conn} the student frowned.	{Prep} the principal , the student smiled and frowned {Conn} the principal smiled.	{Prep} the principal , the student smiled and frowned {Conn} the principal frowned.
{Prep} the student , the principal smiled and frowned {Conn} the principal smiled.	{Prep} the student , the principal smiled and frowned {Conn} the principal frowned.	{Prep} the student , the principal smiled and frowned {Conn} the student smiled.	{Prep} the student , the principal smiled and frowned {Conn} the student frowned.
{Prep} the principal , the student frowned and smiled {Conn} the student frowned.	{Prep} the principal , the student frowned and smiled {Conn} the student smiled.	{Prep} the principal , the student frowned and smiled {Conn} the principal frowned.	{Prep} the principal , the student frowned and smiled {Conn} the principal smiled.
{Prep} the student , the principal frowned and smiled {Conn} the principal frowned.	{Prep} the student , the principal frowned and smiled {Conn} the principal smiled.	{Prep} the student , the principal frowned and smiled {Conn} the student frowned.	{Prep} the student , the principal frowned and smiled {Conn} the student smiled.
{Prep} the river , the sea swelled and shimmered {Conn} the sea swelled.	{Prep} the river , the sea swelled and shimmered {Conn} the sea shimmered.	{Prep} the river , the sea swelled and shimmered {Conn} the river swelled.	{Prep} the river , the sea swelled and shimmered {Conn} the river shimmered.
{Prep} the sea , the river swelled and shimmered {Conn} the river swelled.	{Prep} the sea , the river swelled and shimmered {Conn} the river shimmered.	{Prep} the sea , the river swelled and shimmered {Conn} the sea swelled.	{Prep} the sea , the river swelled and shimmered {Conn} the sea shimmered.
{Prep} the river , the sea shimmered and swelled {Conn} the sea shimmered.	{Prep} the river , the sea shimmered and swelled {Conn} the sea swelled.	{Prep} the river , the sea shimmered and swelled {Conn} the river shimmered.	{Prep} the river , the sea shimmered and swelled {Conn} the river swelled.
{Prep} the sea , the river shimmered and swelled {Conn} the river shimmered.	{Prep} the sea , the river shimmered and swelled {Conn} the river swelled.	{Prep} the sea , the river shimmered and swelled {Conn} the sea shimmered.	{Prep} the sea , the river shimmered and swelled {Conn} the sea swelled.
