E_nX	E_X	C_nX	C_X
The bride that slapped the priest frowned. Thus, the bride slapped the priest.|The bride that slapped the priest frowned. That is, the bride slapped the priest.|The bride that slapped the priest frowned. Therefore, the bride slapped the priest.|The bride that slapped the priest frowned. In short, the bride slapped the priest.|The bride that slapped the priest frowned. Again, the bride slapped the priest.|The bride that slapped the priest frowned. I repeat, the bride slapped the priest.|The bride that slapped the priest frowned; thus, the bride slapped the priest.|The bride that slapped the priest frowned; that is, the bride slapped the priest.|The bride that slapped the priest frowned; therefore, the bride slapped the priest.|The bride that slapped the priest frowned; in short, the bride slapped the priest.|The bride that slapped the priest frowned; again, the bride slapped the priest.|The bride that slapped the priest frowned; I repeat, the bride slapped the priest.|The bride that slapped the priest frowned. Thus, the bride slapped the priest.|The bride that slapped the priest frowned. That is, the bride slapped the priest.|The bride that slapped the priest frowned. Therefore, the bride slapped the priest.|The bride that slapped the priest frowned. In short, the bride slapped the priest.|The bride that slapped the priest frowned. Again, the bride slapped the priest.|The bride that slapped the priest frowned. I repeat, the bride slapped the priest.|The bride that slapped the priest frowned; thus, the bride slapped the priest.|The bride that slapped the priest frowned; that is, the bride slapped the priest.|The bride that slapped the priest frowned; therefore, the bride slapped the priest.|The bride that slapped the priest frowned; in short, the bride slapped the priest.|The bride that slapped the priest frowned; again, the bride slapped the priest.|The bride that slapped the priest frowned; I repeat, the bride slapped the priest.	The bride that slapped the priest frowned. Thus, the bride frowned.|The bride that slapped the priest frowned. That is, the bride frowned.|The bride that slapped the priest frowned. Therefore, the bride frowned.|The bride that slapped the priest frowned. In short, the bride frowned.|The bride that slapped the priest frowned. Again, the bride frowned.|The bride that slapped the priest frowned. I repeat, the bride frowned.|The bride that slapped the priest frowned; thus, the bride frowned.|The bride that slapped the priest frowned; that is, the bride frowned.|The bride that slapped the priest frowned; therefore, the bride frowned.|The bride that slapped the priest frowned; in short, the bride frowned.|The bride that slapped the priest frowned; again, the bride frowned.|The bride that slapped the priest frowned; I repeat, the bride frowned.|The bride that slapped the priest frowned. Thus, the bride frowned.|The bride that slapped the priest frowned. That is, the bride frowned.|The bride that slapped the priest frowned. Therefore, the bride frowned.|The bride that slapped the priest frowned. In short, the bride frowned.|The bride that slapped the priest frowned. Again, the bride frowned.|The bride that slapped the priest frowned. I repeat, the bride frowned.|The bride that slapped the priest frowned; thus, the bride frowned.|The bride that slapped the priest frowned; that is, the bride frowned.|The bride that slapped the priest frowned; therefore, the bride frowned.|The bride that slapped the priest frowned; in short, the bride frowned.|The bride that slapped the priest frowned; again, the bride frowned.|The bride that slapped the priest frowned; I repeat, the bride frowned.	The bride that slapped the priest frowned. Thus, the priest slapped the bride.|The bride that slapped the priest frowned. That is, the priest slapped the bride.|The bride that slapped the priest frowned. Therefore, the priest slapped the bride.|The bride that slapped the priest frowned. In short, the priest slapped the bride.|The bride that slapped the priest frowned. Again, the priest slapped the bride.|The bride that slapped the priest frowned. I repeat, the priest slapped the bride.|The bride that slapped the priest frowned; thus, the priest slapped the bride.|The bride that slapped the priest frowned; that is, the priest slapped the bride.|The bride that slapped the priest frowned; therefore, the priest slapped the bride.|The bride that slapped the priest frowned; in short, the priest slapped the bride.|The bride that slapped the priest frowned; again, the priest slapped the bride.|The bride that slapped the priest frowned; I repeat, the priest slapped the bride.|The bride that slapped the priest frowned. Thus, the priest slapped the bride.|The bride that slapped the priest frowned. That is, the priest slapped the bride.|The bride that slapped the priest frowned. Therefore, the priest slapped the bride.|The bride that slapped the priest frowned. In short, the priest slapped the bride.|The bride that slapped the priest frowned. Again, the priest slapped the bride.|The bride that slapped the priest frowned. I repeat, the priest slapped the bride.|The bride that slapped the priest frowned; thus, the priest slapped the bride.|The bride that slapped the priest frowned; that is, the priest slapped the bride.|The bride that slapped the priest frowned; therefore, the priest slapped the bride.|The bride that slapped the priest frowned; in short, the priest slapped the bride.|The bride that slapped the priest frowned; again, the priest slapped the bride.|The bride that slapped the priest frowned; I repeat, the priest slapped the bride.	The bride that slapped the priest frowned. Thus, the priest frowned.|The bride that slapped the priest frowned. That is, the priest frowned.|The bride that slapped the priest frowned. Therefore, the priest frowned.|The bride that slapped the priest frowned. In short, the priest frowned.|The bride that slapped the priest frowned. Again, the priest frowned.|The bride that slapped the priest frowned. I repeat, the priest frowned.|The bride that slapped the priest frowned; thus, the priest frowned.|The bride that slapped the priest frowned; that is, the priest frowned.|The bride that slapped the priest frowned; therefore, the priest frowned.|The bride that slapped the priest frowned; in short, the priest frowned.|The bride that slapped the priest frowned; again, the priest frowned.|The bride that slapped the priest frowned; I repeat, the priest frowned.|The bride that slapped the priest frowned. Thus, the priest frowned.|The bride that slapped the priest frowned. That is, the priest frowned.|The bride that slapped the priest frowned. Therefore, the priest frowned.|The bride that slapped the priest frowned. In short, the priest frowned.|The bride that slapped the priest frowned. Again, the priest frowned.|The bride that slapped the priest frowned. I repeat, the priest frowned.|The bride that slapped the priest frowned; thus, the priest frowned.|The bride that slapped the priest frowned; that is, the priest frowned.|The bride that slapped the priest frowned; therefore, the priest frowned.|The bride that slapped the priest frowned; in short, the priest frowned.|The bride that slapped the priest frowned; again, the priest frowned.|The bride that slapped the priest frowned; I repeat, the priest frowned.
The priest that slapped the bride frowned. Thus, the priest slapped the bride.|The priest that slapped the bride frowned. That is, the priest slapped the bride.|The priest that slapped the bride frowned. Therefore, the priest slapped the bride.|The priest that slapped the bride frowned. In short, the priest slapped the bride.|The priest that slapped the bride frowned. Again, the priest slapped the bride.|The priest that slapped the bride frowned. I repeat, the priest slapped the bride.|The priest that slapped the bride frowned; thus, the priest slapped the bride.|The priest that slapped the bride frowned; that is, the priest slapped the bride.|The priest that slapped the bride frowned; therefore, the priest slapped the bride.|The priest that slapped the bride frowned; in short, the priest slapped the bride.|The priest that slapped the bride frowned; again, the priest slapped the bride.|The priest that slapped the bride frowned; I repeat, the priest slapped the bride.|The priest that slapped the bride frowned. Thus, the priest slapped the bride.|The priest that slapped the bride frowned. That is, the priest slapped the bride.|The priest that slapped the bride frowned. Therefore, the priest slapped the bride.|The priest that slapped the bride frowned. In short, the priest slapped the bride.|The priest that slapped the bride frowned. Again, the priest slapped the bride.|The priest that slapped the bride frowned. I repeat, the priest slapped the bride.|The priest that slapped the bride frowned; thus, the priest slapped the bride.|The priest that slapped the bride frowned; that is, the priest slapped the bride.|The priest that slapped the bride frowned; therefore, the priest slapped the bride.|The priest that slapped the bride frowned; in short, the priest slapped the bride.|The priest that slapped the bride frowned; again, the priest slapped the bride.|The priest that slapped the bride frowned; I repeat, the priest slapped the bride.	The priest that slapped the bride frowned. Thus, the priest frowned.|The priest that slapped the bride frowned. That is, the priest frowned.|The priest that slapped the bride frowned. Therefore, the priest frowned.|The priest that slapped the bride frowned. In short, the priest frowned.|The priest that slapped the bride frowned. Again, the priest frowned.|The priest that slapped the bride frowned. I repeat, the priest frowned.|The priest that slapped the bride frowned; thus, the priest frowned.|The priest that slapped the bride frowned; that is, the priest frowned.|The priest that slapped the bride frowned; therefore, the priest frowned.|The priest that slapped the bride frowned; in short, the priest frowned.|The priest that slapped the bride frowned; again, the priest frowned.|The priest that slapped the bride frowned; I repeat, the priest frowned.|The priest that slapped the bride frowned. Thus, the priest frowned.|The priest that slapped the bride frowned. That is, the priest frowned.|The priest that slapped the bride frowned. Therefore, the priest frowned.|The priest that slapped the bride frowned. In short, the priest frowned.|The priest that slapped the bride frowned. Again, the priest frowned.|The priest that slapped the bride frowned. I repeat, the priest frowned.|The priest that slapped the bride frowned; thus, the priest frowned.|The priest that slapped the bride frowned; that is, the priest frowned.|The priest that slapped the bride frowned; therefore, the priest frowned.|The priest that slapped the bride frowned; in short, the priest frowned.|The priest that slapped the bride frowned; again, the priest frowned.|The priest that slapped the bride frowned; I repeat, the priest frowned.	The priest that slapped the bride frowned. Thus, the bride slapped the priest.|The priest that slapped the bride frowned. That is, the bride slapped the priest.|The priest that slapped the bride frowned. Therefore, the bride slapped the priest.|The priest that slapped the bride frowned. In short, the bride slapped the priest.|The priest that slapped the bride frowned. Again, the bride slapped the priest.|The priest that slapped the bride frowned. I repeat, the bride slapped the priest.|The priest that slapped the bride frowned; thus, the bride slapped the priest.|The priest that slapped the bride frowned; that is, the bride slapped the priest.|The priest that slapped the bride frowned; therefore, the bride slapped the priest.|The priest that slapped the bride frowned; in short, the bride slapped the priest.|The priest that slapped the bride frowned; again, the bride slapped the priest.|The priest that slapped the bride frowned; I repeat, the bride slapped the priest.|The priest that slapped the bride frowned. Thus, the bride slapped the priest.|The priest that slapped the bride frowned. That is, the bride slapped the priest.|The priest that slapped the bride frowned. Therefore, the bride slapped the priest.|The priest that slapped the bride frowned. In short, the bride slapped the priest.|The priest that slapped the bride frowned. Again, the bride slapped the priest.|The priest that slapped the bride frowned. I repeat, the bride slapped the priest.|The priest that slapped the bride frowned; thus, the bride slapped the priest.|The priest that slapped the bride frowned; that is, the bride slapped the priest.|The priest that slapped the bride frowned; therefore, the bride slapped the priest.|The priest that slapped the bride frowned; in short, the bride slapped the priest.|The priest that slapped the bride frowned; again, the bride slapped the priest.|The priest that slapped the bride frowned; I repeat, the bride slapped the priest.	The priest that slapped the bride frowned. Thus, the bride frowned.|The priest that slapped the bride frowned. That is, the bride frowned.|The priest that slapped the bride frowned. Therefore, the bride frowned.|The priest that slapped the bride frowned. In short, the bride frowned.|The priest that slapped the bride frowned. Again, the bride frowned.|The priest that slapped the bride frowned. I repeat, the bride frowned.|The priest that slapped the bride frowned; thus, the bride frowned.|The priest that slapped the bride frowned; that is, the bride frowned.|The priest that slapped the bride frowned; therefore, the bride frowned.|The priest that slapped the bride frowned; in short, the bride frowned.|The priest that slapped the bride frowned; again, the bride frowned.|The priest that slapped the bride frowned; I repeat, the bride frowned.|The priest that slapped the bride frowned. Thus, the bride frowned.|The priest that slapped the bride frowned. That is, the bride frowned.|The priest that slapped the bride frowned. Therefore, the bride frowned.|The priest that slapped the bride frowned. In short, the bride frowned.|The priest that slapped the bride frowned. Again, the bride frowned.|The priest that slapped the bride frowned. I repeat, the bride frowned.|The priest that slapped the bride frowned; thus, the bride frowned.|The priest that slapped the bride frowned; that is, the bride frowned.|The priest that slapped the bride frowned; therefore, the bride frowned.|The priest that slapped the bride frowned; in short, the bride frowned.|The priest that slapped the bride frowned; again, the bride frowned.|The priest that slapped the bride frowned; I repeat, the bride frowned.
The bee that appreciated the flower sang. Thus, the bee appreciated the flower.|The bee that appreciated the flower sang. That is, the bee appreciated the flower.|The bee that appreciated the flower sang. Therefore, the bee appreciated the flower.|The bee that appreciated the flower sang. In short, the bee appreciated the flower.|The bee that appreciated the flower sang. Again, the bee appreciated the flower.|The bee that appreciated the flower sang. I repeat, the bee appreciated the flower.|The bee that appreciated the flower sang; thus, the bee appreciated the flower.|The bee that appreciated the flower sang; that is, the bee appreciated the flower.|The bee that appreciated the flower sang; therefore, the bee appreciated the flower.|The bee that appreciated the flower sang; in short, the bee appreciated the flower.|The bee that appreciated the flower sang; again, the bee appreciated the flower.|The bee that appreciated the flower sang; I repeat, the bee appreciated the flower.|The bee that appreciated the flower sang. Thus, the bee appreciated the flower.|The bee that appreciated the flower sang. That is, the bee appreciated the flower.|The bee that appreciated the flower sang. Therefore, the bee appreciated the flower.|The bee that appreciated the flower sang. In short, the bee appreciated the flower.|The bee that appreciated the flower sang. Again, the bee appreciated the flower.|The bee that appreciated the flower sang. I repeat, the bee appreciated the flower.|The bee that appreciated the flower sang; thus, the bee appreciated the flower.|The bee that appreciated the flower sang; that is, the bee appreciated the flower.|The bee that appreciated the flower sang; therefore, the bee appreciated the flower.|The bee that appreciated the flower sang; in short, the bee appreciated the flower.|The bee that appreciated the flower sang; again, the bee appreciated the flower.|The bee that appreciated the flower sang; I repeat, the bee appreciated the flower.	The bee that appreciated the flower sang. Thus, the bee sang.|The bee that appreciated the flower sang. That is, the bee sang.|The bee that appreciated the flower sang. Therefore, the bee sang.|The bee that appreciated the flower sang. In short, the bee sang.|The bee that appreciated the flower sang. Again, the bee sang.|The bee that appreciated the flower sang. I repeat, the bee sang.|The bee that appreciated the flower sang; thus, the bee sang.|The bee that appreciated the flower sang; that is, the bee sang.|The bee that appreciated the flower sang; therefore, the bee sang.|The bee that appreciated the flower sang; in short, the bee sang.|The bee that appreciated the flower sang; again, the bee sang.|The bee that appreciated the flower sang; I repeat, the bee sang.|The bee that appreciated the flower sang. Thus, the bee sang.|The bee that appreciated the flower sang. That is, the bee sang.|The bee that appreciated the flower sang. Therefore, the bee sang.|The bee that appreciated the flower sang. In short, the bee sang.|The bee that appreciated the flower sang. Again, the bee sang.|The bee that appreciated the flower sang. I repeat, the bee sang.|The bee that appreciated the flower sang; thus, the bee sang.|The bee that appreciated the flower sang; that is, the bee sang.|The bee that appreciated the flower sang; therefore, the bee sang.|The bee that appreciated the flower sang; in short, the bee sang.|The bee that appreciated the flower sang; again, the bee sang.|The bee that appreciated the flower sang; I repeat, the bee sang.	The bee that appreciated the flower sang. Thus, the flower appreciated the bee.|The bee that appreciated the flower sang. That is, the flower appreciated the bee.|The bee that appreciated the flower sang. Therefore, the flower appreciated the bee.|The bee that appreciated the flower sang. In short, the flower appreciated the bee.|The bee that appreciated the flower sang. Again, the flower appreciated the bee.|The bee that appreciated the flower sang. I repeat, the flower appreciated the bee.|The bee that appreciated the flower sang; thus, the flower appreciated the bee.|The bee that appreciated the flower sang; that is, the flower appreciated the bee.|The bee that appreciated the flower sang; therefore, the flower appreciated the bee.|The bee that appreciated the flower sang; in short, the flower appreciated the bee.|The bee that appreciated the flower sang; again, the flower appreciated the bee.|The bee that appreciated the flower sang; I repeat, the flower appreciated the bee.|The bee that appreciated the flower sang. Thus, the flower appreciated the bee.|The bee that appreciated the flower sang. That is, the flower appreciated the bee.|The bee that appreciated the flower sang. Therefore, the flower appreciated the bee.|The bee that appreciated the flower sang. In short, the flower appreciated the bee.|The bee that appreciated the flower sang. Again, the flower appreciated the bee.|The bee that appreciated the flower sang. I repeat, the flower appreciated the bee.|The bee that appreciated the flower sang; thus, the flower appreciated the bee.|The bee that appreciated the flower sang; that is, the flower appreciated the bee.|The bee that appreciated the flower sang; therefore, the flower appreciated the bee.|The bee that appreciated the flower sang; in short, the flower appreciated the bee.|The bee that appreciated the flower sang; again, the flower appreciated the bee.|The bee that appreciated the flower sang; I repeat, the flower appreciated the bee.	The bee that appreciated the flower sang. Thus, the flower sang.|The bee that appreciated the flower sang. That is, the flower sang.|The bee that appreciated the flower sang. Therefore, the flower sang.|The bee that appreciated the flower sang. In short, the flower sang.|The bee that appreciated the flower sang. Again, the flower sang.|The bee that appreciated the flower sang. I repeat, the flower sang.|The bee that appreciated the flower sang; thus, the flower sang.|The bee that appreciated the flower sang; that is, the flower sang.|The bee that appreciated the flower sang; therefore, the flower sang.|The bee that appreciated the flower sang; in short, the flower sang.|The bee that appreciated the flower sang; again, the flower sang.|The bee that appreciated the flower sang; I repeat, the flower sang.|The bee that appreciated the flower sang. Thus, the flower sang.|The bee that appreciated the flower sang. That is, the flower sang.|The bee that appreciated the flower sang. Therefore, the flower sang.|The bee that appreciated the flower sang. In short, the flower sang.|The bee that appreciated the flower sang. Again, the flower sang.|The bee that appreciated the flower sang. I repeat, the flower sang.|The bee that appreciated the flower sang; thus, the flower sang.|The bee that appreciated the flower sang; that is, the flower sang.|The bee that appreciated the flower sang; therefore, the flower sang.|The bee that appreciated the flower sang; in short, the flower sang.|The bee that appreciated the flower sang; again, the flower sang.|The bee that appreciated the flower sang; I repeat, the flower sang.
