E_nX	E_X	C_nX	C_X
The car that hit the tree burned. Thus, the car hit the tree.|The car that hit the tree burned. That is, the car hit the tree.|The car that hit the tree burned. Therefore, the car hit the tree.|The car that hit the tree burned. In short, the car hit the tree.|The car that hit the tree burned. Again, the car hit the tree.|The car that hit the tree burned. I repeat, the car hit the tree.|The car that hit the tree burned; thus, the car hit the tree.|The car that hit the tree burned; that is, the car hit the tree.|The car that hit the tree burned; therefore, the car hit the tree.|The car that hit the tree burned; in short, the car hit the tree.|The car that hit the tree burned; again, the car hit the tree.|The car that hit the tree burned; I repeat, the car hit the tree.|The car that hit the tree burned. Thus, the car hit the tree.|The car that hit the tree burned. That is, the car hit the tree.|The car that hit the tree burned. Therefore, the car hit the tree.|The car that hit the tree burned. In short, the car hit the tree.|The car that hit the tree burned. Again, the car hit the tree.|The car that hit the tree burned. I repeat, the car hit the tree.|The car that hit the tree burned; thus, the car hit the tree.|The car that hit the tree burned; that is, the car hit the tree.|The car that hit the tree burned; therefore, the car hit the tree.|The car that hit the tree burned; in short, the car hit the tree.|The car that hit the tree burned; again, the car hit the tree.|The car that hit the tree burned; I repeat, the car hit the tree.	The car that hit the tree burned. Thus, the car burned.|The car that hit the tree burned. That is, the car burned.|The car that hit the tree burned. Therefore, the car burned.|The car that hit the tree burned. In short, the car burned.|The car that hit the tree burned. Again, the car burned.|The car that hit the tree burned. I repeat, the car burned.|The car that hit the tree burned; thus, the car burned.|The car that hit the tree burned; that is, the car burned.|The car that hit the tree burned; therefore, the car burned.|The car that hit the tree burned; in short, the car burned.|The car that hit the tree burned; again, the car burned.|The car that hit the tree burned; I repeat, the car burned.|The car that hit the tree burned. Thus, the car burned.|The car that hit the tree burned. That is, the car burned.|The car that hit the tree burned. Therefore, the car burned.|The car that hit the tree burned. In short, the car burned.|The car that hit the tree burned. Again, the car burned.|The car that hit the tree burned. I repeat, the car burned.|The car that hit the tree burned; thus, the car burned.|The car that hit the tree burned; that is, the car burned.|The car that hit the tree burned; therefore, the car burned.|The car that hit the tree burned; in short, the car burned.|The car that hit the tree burned; again, the car burned.|The car that hit the tree burned; I repeat, the car burned.	The car that hit the tree burned. Thus, the tree hit the car.|The car that hit the tree burned. That is, the tree hit the car.|The car that hit the tree burned. Therefore, the tree hit the car.|The car that hit the tree burned. In short, the tree hit the car.|The car that hit the tree burned. Again, the tree hit the car.|The car that hit the tree burned. I repeat, the tree hit the car.|The car that hit the tree burned; thus, the tree hit the car.|The car that hit the tree burned; that is, the tree hit the car.|The car that hit the tree burned; therefore, the tree hit the car.|The car that hit the tree burned; in short, the tree hit the car.|The car that hit the tree burned; again, the tree hit the car.|The car that hit the tree burned; I repeat, the tree hit the car.|The car that hit the tree burned. Thus, the tree hit the car.|The car that hit the tree burned. That is, the tree hit the car.|The car that hit the tree burned. Therefore, the tree hit the car.|The car that hit the tree burned. In short, the tree hit the car.|The car that hit the tree burned. Again, the tree hit the car.|The car that hit the tree burned. I repeat, the tree hit the car.|The car that hit the tree burned; thus, the tree hit the car.|The car that hit the tree burned; that is, the tree hit the car.|The car that hit the tree burned; therefore, the tree hit the car.|The car that hit the tree burned; in short, the tree hit the car.|The car that hit the tree burned; again, the tree hit the car.|The car that hit the tree burned; I repeat, the tree hit the car.	The car that hit the tree burned. Thus, the tree burned.|The car that hit the tree burned. That is, the tree burned.|The car that hit the tree burned. Therefore, the tree burned.|The car that hit the tree burned. In short, the tree burned.|The car that hit the tree burned. Again, the tree burned.|The car that hit the tree burned. I repeat, the tree burned.|The car that hit the tree burned; thus, the tree burned.|The car that hit the tree burned; that is, the tree burned.|The car that hit the tree burned; therefore, the tree burned.|The car that hit the tree burned; in short, the tree burned.|The car that hit the tree burned; again, the tree burned.|The car that hit the tree burned; I repeat, the tree burned.|The car that hit the tree burned. Thus, the tree burned.|The car that hit the tree burned. That is, the tree burned.|The car that hit the tree burned. Therefore, the tree burned.|The car that hit the tree burned. In short, the tree burned.|The car that hit the tree burned. Again, the tree burned.|The car that hit the tree burned. I repeat, the tree burned.|The car that hit the tree burned; thus, the tree burned.|The car that hit the tree burned; that is, the tree burned.|The car that hit the tree burned; therefore, the tree burned.|The car that hit the tree burned; in short, the tree burned.|The car that hit the tree burned; again, the tree burned.|The car that hit the tree burned; I repeat, the tree burned.
The tree that hit the car burned. Thus, the tree hit the car.|The tree that hit the car burned. That is, the tree hit the car.|The tree that hit the car burned. Therefore, the tree hit the car.|The tree that hit the car burned. In short, the tree hit the car.|The tree that hit the car burned. Again, the tree hit the car.|The tree that hit the car burned. I repeat, the tree hit the car.|The tree that hit the car burned; thus, the tree hit the car.|The tree that hit the car burned; that is, the tree hit the car.|The tree that hit the car burned; therefore, the tree hit the car.|The tree that hit the car burned; in short, the tree hit the car.|The tree that hit the car burned; again, the tree hit the car.|The tree that hit the car burned; I repeat, the tree hit the car.|The tree that hit the car burned. Thus, the tree hit the car.|The tree that hit the car burned. That is, the tree hit the car.|The tree that hit the car burned. Therefore, the tree hit the car.|The tree that hit the car burned. In short, the tree hit the car.|The tree that hit the car burned. Again, the tree hit the car.|The tree that hit the car burned. I repeat, the tree hit the car.|The tree that hit the car burned; thus, the tree hit the car.|The tree that hit the car burned; that is, the tree hit the car.|The tree that hit the car burned; therefore, the tree hit the car.|The tree that hit the car burned; in short, the tree hit the car.|The tree that hit the car burned; again, the tree hit the car.|The tree that hit the car burned; I repeat, the tree hit the car.	The tree that hit the car burned. Thus, the tree burned.|The tree that hit the car burned. That is, the tree burned.|The tree that hit the car burned. Therefore, the tree burned.|The tree that hit the car burned. In short, the tree burned.|The tree that hit the car burned. Again, the tree burned.|The tree that hit the car burned. I repeat, the tree burned.|The tree that hit the car burned; thus, the tree burned.|The tree that hit the car burned; that is, the tree burned.|The tree that hit the car burned; therefore, the tree burned.|The tree that hit the car burned; in short, the tree burned.|The tree that hit the car burned; again, the tree burned.|The tree that hit the car burned; I repeat, the tree burned.|The tree that hit the car burned. Thus, the tree burned.|The tree that hit the car burned. That is, the tree burned.|The tree that hit the car burned. Therefore, the tree burned.|The tree that hit the car burned. In short, the tree burned.|The tree that hit the car burned. Again, the tree burned.|The tree that hit the car burned. I repeat, the tree burned.|The tree that hit the car burned; thus, the tree burned.|The tree that hit the car burned; that is, the tree burned.|The tree that hit the car burned; therefore, the tree burned.|The tree that hit the car burned; in short, the tree burned.|The tree that hit the car burned; again, the tree burned.|The tree that hit the car burned; I repeat, the tree burned.	The tree that hit the car burned. Thus, the car hit the tree.|The tree that hit the car burned. That is, the car hit the tree.|The tree that hit the car burned. Therefore, the car hit the tree.|The tree that hit the car burned. In short, the car hit the tree.|The tree that hit the car burned. Again, the car hit the tree.|The tree that hit the car burned. I repeat, the car hit the tree.|The tree that hit the car burned; thus, the car hit the tree.|The tree that hit the car burned; that is, the car hit the tree.|The tree that hit the car burned; therefore, the car hit the tree.|The tree that hit the car burned; in short, the car hit the tree.|The tree that hit the car burned; again, the car hit the tree.|The tree that hit the car burned; I repeat, the car hit the tree.|The tree that hit the car burned. Thus, the car hit the tree.|The tree that hit the car burned. That is, the car hit the tree.|The tree that hit the car burned. Therefore, the car hit the tree.|The tree that hit the car burned. In short, the car hit the tree.|The tree that hit the car burned. Again, the car hit the tree.|The tree that hit the car burned. I repeat, the car hit the tree.|The tree that hit the car burned; thus, the car hit the tree.|The tree that hit the car burned; that is, the car hit the tree.|The tree that hit the car burned; therefore, the car hit the tree.|The tree that hit the car burned; in short, the car hit the tree.|The tree that hit the car burned; again, the car hit the tree.|The tree that hit the car burned; I repeat, the car hit the tree.	The tree that hit the car burned. Thus, the car burned.|The tree that hit the car burned. That is, the car burned.|The tree that hit the car burned. Therefore, the car burned.|The tree that hit the car burned. In short, the car burned.|The tree that hit the car burned. Again, the car burned.|The tree that hit the car burned. I repeat, the car burned.|The tree that hit the car burned; thus, the car burned.|The tree that hit the car burned; that is, the car burned.|The tree that hit the car burned; therefore, the car burned.|The tree that hit the car burned; in short, the car burned.|The tree that hit the car burned; again, the car burned.|The tree that hit the car burned; I repeat, the car burned.|The tree that hit the car burned. Thus, the car burned.|The tree that hit the car burned. That is, the car burned.|The tree that hit the car burned. Therefore, the car burned.|The tree that hit the car burned. In short, the car burned.|The tree that hit the car burned. Again, the car burned.|The tree that hit the car burned. I repeat, the car burned.|The tree that hit the car burned; thus, the car burned.|The tree that hit the car burned; that is, the car burned.|The tree that hit the car burned; therefore, the car burned.|The tree that hit the car burned; in short, the car burned.|The tree that hit the car burned; again, the car burned.|The tree that hit the car burned; I repeat, the car burned.
The car that hit the tree shook. Thus, the car hit the tree.|The car that hit the tree shook. That is, the car hit the tree.|The car that hit the tree shook. Therefore, the car hit the tree.|The car that hit the tree shook. In short, the car hit the tree.|The car that hit the tree shook. Again, the car hit the tree.|The car that hit the tree shook. I repeat, the car hit the tree.|The car that hit the tree shook; thus, the car hit the tree.|The car that hit the tree shook; that is, the car hit the tree.|The car that hit the tree shook; therefore, the car hit the tree.|The car that hit the tree shook; in short, the car hit the tree.|The car that hit the tree shook; again, the car hit the tree.|The car that hit the tree shook; I repeat, the car hit the tree.|The car that hit the tree shook. Thus, the car hit the tree.|The car that hit the tree shook. That is, the car hit the tree.|The car that hit the tree shook. Therefore, the car hit the tree.|The car that hit the tree shook. In short, the car hit the tree.|The car that hit the tree shook. Again, the car hit the tree.|The car that hit the tree shook. I repeat, the car hit the tree.|The car that hit the tree shook; thus, the car hit the tree.|The car that hit the tree shook; that is, the car hit the tree.|The car that hit the tree shook; therefore, the car hit the tree.|The car that hit the tree shook; in short, the car hit the tree.|The car that hit the tree shook; again, the car hit the tree.|The car that hit the tree shook; I repeat, the car hit the tree.	The car that hit the tree shook. Thus, the car shook.|The car that hit the tree shook. That is, the car shook.|The car that hit the tree shook. Therefore, the car shook.|The car that hit the tree shook. In short, the car shook.|The car that hit the tree shook. Again, the car shook.|The car that hit the tree shook. I repeat, the car shook.|The car that hit the tree shook; thus, the car shook.|The car that hit the tree shook; that is, the car shook.|The car that hit the tree shook; therefore, the car shook.|The car that hit the tree shook; in short, the car shook.|The car that hit the tree shook; again, the car shook.|The car that hit the tree shook; I repeat, the car shook.|The car that hit the tree shook. Thus, the car shook.|The car that hit the tree shook. That is, the car shook.|The car that hit the tree shook. Therefore, the car shook.|The car that hit the tree shook. In short, the car shook.|The car that hit the tree shook. Again, the car shook.|The car that hit the tree shook. I repeat, the car shook.|The car that hit the tree shook; thus, the car shook.|The car that hit the tree shook; that is, the car shook.|The car that hit the tree shook; therefore, the car shook.|The car that hit the tree shook; in short, the car shook.|The car that hit the tree shook; again, the car shook.|The car that hit the tree shook; I repeat, the car shook.	The car that hit the tree shook. Thus, the tree hit the car.|The car that hit the tree shook. That is, the tree hit the car.|The car that hit the tree shook. Therefore, the tree hit the car.|The car that hit the tree shook. In short, the tree hit the car.|The car that hit the tree shook. Again, the tree hit the car.|The car that hit the tree shook. I repeat, the tree hit the car.|The car that hit the tree shook; thus, the tree hit the car.|The car that hit the tree shook; that is, the tree hit the car.|The car that hit the tree shook; therefore, the tree hit the car.|The car that hit the tree shook; in short, the tree hit the car.|The car that hit the tree shook; again, the tree hit the car.|The car that hit the tree shook; I repeat, the tree hit the car.|The car that hit the tree shook. Thus, the tree hit the car.|The car that hit the tree shook. That is, the tree hit the car.|The car that hit the tree shook. Therefore, the tree hit the car.|The car that hit the tree shook. In short, the tree hit the car.|The car that hit the tree shook. Again, the tree hit the car.|The car that hit the tree shook. I repeat, the tree hit the car.|The car that hit the tree shook; thus, the tree hit the car.|The car that hit the tree shook; that is, the tree hit the car.|The car that hit the tree shook; therefore, the tree hit the car.|The car that hit the tree shook; in short, the tree hit the car.|The car that hit the tree shook; again, the tree hit the car.|The car that hit the tree shook; I repeat, the tree hit the car.	The car that hit the tree shook. Thus, the tree shook.|The car that hit the tree shook. That is, the tree shook.|The car that hit the tree shook. Therefore, the tree shook.|The car that hit the tree shook. In short, the tree shook.|The car that hit the tree shook. Again, the tree shook.|The car that hit the tree shook. I repeat, the tree shook.|The car that hit the tree shook; thus, the tree shook.|The car that hit the tree shook; that is, the tree shook.|The car that hit the tree shook; therefore, the tree shook.|The car that hit the tree shook; in short, the tree shook.|The car that hit the tree shook; again, the tree shook.|The car that hit the tree shook; I repeat, the tree shook.|The car that hit the tree shook. Thus, the tree shook.|The car that hit the tree shook. That is, the tree shook.|The car that hit the tree shook. Therefore, the tree shook.|The car that hit the tree shook. In short, the tree shook.|The car that hit the tree shook. Again, the tree shook.|The car that hit the tree shook. I repeat, the tree shook.|The car that hit the tree shook; thus, the tree shook.|The car that hit the tree shook; that is, the tree shook.|The car that hit the tree shook; therefore, the tree shook.|The car that hit the tree shook; in short, the tree shook.|The car that hit the tree shook; again, the tree shook.|The car that hit the tree shook; I repeat, the tree shook.
The tree that hit the car shook. Thus, the tree hit the car.|The tree that hit the car shook. That is, the tree hit the car.|The tree that hit the car shook. Therefore, the tree hit the car.|The tree that hit the car shook. In short, the tree hit the car.|The tree that hit the car shook. Again, the tree hit the car.|The tree that hit the car shook. I repeat, the tree hit the car.|The tree that hit the car shook; thus, the tree hit the car.|The tree that hit the car shook; that is, the tree hit the car.|The tree that hit the car shook; therefore, the tree hit the car.|The tree that hit the car shook; in short, the tree hit the car.|The tree that hit the car shook; again, the tree hit the car.|The tree that hit the car shook; I repeat, the tree hit the car.|The tree that hit the car shook. Thus, the tree hit the car.|The tree that hit the car shook. That is, the tree hit the car.|The tree that hit the car shook. Therefore, the tree hit the car.|The tree that hit the car shook. In short, the tree hit the car.|The tree that hit the car shook. Again, the tree hit the car.|The tree that hit the car shook. I repeat, the tree hit the car.|The tree that hit the car shook; thus, the tree hit the car.|The tree that hit the car shook; that is, the tree hit the car.|The tree that hit the car shook; therefore, the tree hit the car.|The tree that hit the car shook; in short, the tree hit the car.|The tree that hit the car shook; again, the tree hit the car.|The tree that hit the car shook; I repeat, the tree hit the car.	The tree that hit the car shook. Thus, the tree shook.|The tree that hit the car shook. That is, the tree shook.|The tree that hit the car shook. Therefore, the tree shook.|The tree that hit the car shook. In short, the tree shook.|The tree that hit the car shook. Again, the tree shook.|The tree that hit the car shook. I repeat, the tree shook.|The tree that hit the car shook; thus, the tree shook.|The tree that hit the car shook; that is, the tree shook.|The tree that hit the car shook; therefore, the tree shook.|The tree that hit the car shook; in short, the tree shook.|The tree that hit the car shook; again, the tree shook.|The tree that hit the car shook; I repeat, the tree shook.|The tree that hit the car shook. Thus, the tree shook.|The tree that hit the car shook. That is, the tree shook.|The tree that hit the car shook. Therefore, the tree shook.|The tree that hit the car shook. In short, the tree shook.|The tree that hit the car shook. Again, the tree shook.|The tree that hit the car shook. I repeat, the tree shook.|The tree that hit the car shook; thus, the tree shook.|The tree that hit the car shook; that is, the tree shook.|The tree that hit the car shook; therefore, the tree shook.|The tree that hit the car shook; in short, the tree shook.|The tree that hit the car shook; again, the tree shook.|The tree that hit the car shook; I repeat, the tree shook.	The tree that hit the car shook. Thus, the car hit the tree.|The tree that hit the car shook. That is, the car hit the tree.|The tree that hit the car shook. Therefore, the car hit the tree.|The tree that hit the car shook. In short, the car hit the tree.|The tree that hit the car shook. Again, the car hit the tree.|The tree that hit the car shook. I repeat, the car hit the tree.|The tree that hit the car shook; thus, the car hit the tree.|The tree that hit the car shook; that is, the car hit the tree.|The tree that hit the car shook; therefore, the car hit the tree.|The tree that hit the car shook; in short, the car hit the tree.|The tree that hit the car shook; again, the car hit the tree.|The tree that hit the car shook; I repeat, the car hit the tree.|The tree that hit the car shook. Thus, the car hit the tree.|The tree that hit the car shook. That is, the car hit the tree.|The tree that hit the car shook. Therefore, the car hit the tree.|The tree that hit the car shook. In short, the car hit the tree.|The tree that hit the car shook. Again, the car hit the tree.|The tree that hit the car shook. I repeat, the car hit the tree.|The tree that hit the car shook; thus, the car hit the tree.|The tree that hit the car shook; that is, the car hit the tree.|The tree that hit the car shook; therefore, the car hit the tree.|The tree that hit the car shook; in short, the car hit the tree.|The tree that hit the car shook; again, the car hit the tree.|The tree that hit the car shook; I repeat, the car hit the tree.	The tree that hit the car shook. Thus, the car shook.|The tree that hit the car shook. That is, the car shook.|The tree that hit the car shook. Therefore, the car shook.|The tree that hit the car shook. In short, the car shook.|The tree that hit the car shook. Again, the car shook.|The tree that hit the car shook. I repeat, the car shook.|The tree that hit the car shook; thus, the car shook.|The tree that hit the car shook; that is, the car shook.|The tree that hit the car shook; therefore, the car shook.|The tree that hit the car shook; in short, the car shook.|The tree that hit the car shook; again, the car shook.|The tree that hit the car shook; I repeat, the car shook.|The tree that hit the car shook. Thus, the car shook.|The tree that hit the car shook. That is, the car shook.|The tree that hit the car shook. Therefore, the car shook.|The tree that hit the car shook. In short, the car shook.|The tree that hit the car shook. Again, the car shook.|The tree that hit the car shook. I repeat, the car shook.|The tree that hit the car shook; thus, the car shook.|The tree that hit the car shook; that is, the car shook.|The tree that hit the car shook; therefore, the car shook.|The tree that hit the car shook; in short, the car shook.|The tree that hit the car shook; again, the car shook.|The tree that hit the car shook; I repeat, the car shook.
