E_nX	E_X	C_nX	C_X
The grasshopper that saw the ant played. Thus, the grasshopper saw the ant.|The grasshopper that saw the ant played. That is, the grasshopper saw the ant.|The grasshopper that saw the ant played. Therefore, the grasshopper saw the ant.|The grasshopper that saw the ant played. In short, the grasshopper saw the ant.|The grasshopper that saw the ant played. Again, the grasshopper saw the ant.|The grasshopper that saw the ant played. I repeat, the grasshopper saw the ant.|The grasshopper that saw the ant played; thus, the grasshopper saw the ant.|The grasshopper that saw the ant played; that is, the grasshopper saw the ant.|The grasshopper that saw the ant played; therefore, the grasshopper saw the ant.|The grasshopper that saw the ant played; in short, the grasshopper saw the ant.|The grasshopper that saw the ant played; again, the grasshopper saw the ant.|The grasshopper that saw the ant played; I repeat, the grasshopper saw the ant.|The grasshopper that saw the ant played. Thus, the grasshopper saw the ant.|The grasshopper that saw the ant played. That is, the grasshopper saw the ant.|The grasshopper that saw the ant played. Therefore, the grasshopper saw the ant.|The grasshopper that saw the ant played. In short, the grasshopper saw the ant.|The grasshopper that saw the ant played. Again, the grasshopper saw the ant.|The grasshopper that saw the ant played. I repeat, the grasshopper saw the ant.|The grasshopper that saw the ant played; thus, the grasshopper saw the ant.|The grasshopper that saw the ant played; that is, the grasshopper saw the ant.|The grasshopper that saw the ant played; therefore, the grasshopper saw the ant.|The grasshopper that saw the ant played; in short, the grasshopper saw the ant.|The grasshopper that saw the ant played; again, the grasshopper saw the ant.|The grasshopper that saw the ant played; I repeat, the grasshopper saw the ant.	The grasshopper that saw the ant played. Thus, the grasshopper played.|The grasshopper that saw the ant played. That is, the grasshopper played.|The grasshopper that saw the ant played. Therefore, the grasshopper played.|The grasshopper that saw the ant played. In short, the grasshopper played.|The grasshopper that saw the ant played. Again, the grasshopper played.|The grasshopper that saw the ant played. I repeat, the grasshopper played.|The grasshopper that saw the ant played; thus, the grasshopper played.|The grasshopper that saw the ant played; that is, the grasshopper played.|The grasshopper that saw the ant played; therefore, the grasshopper played.|The grasshopper that saw the ant played; in short, the grasshopper played.|The grasshopper that saw the ant played; again, the grasshopper played.|The grasshopper that saw the ant played; I repeat, the grasshopper played.|The grasshopper that saw the ant played. Thus, the grasshopper played.|The grasshopper that saw the ant played. That is, the grasshopper played.|The grasshopper that saw the ant played. Therefore, the grasshopper played.|The grasshopper that saw the ant played. In short, the grasshopper played.|The grasshopper that saw the ant played. Again, the grasshopper played.|The grasshopper that saw the ant played. I repeat, the grasshopper played.|The grasshopper that saw the ant played; thus, the grasshopper played.|The grasshopper that saw the ant played; that is, the grasshopper played.|The grasshopper that saw the ant played; therefore, the grasshopper played.|The grasshopper that saw the ant played; in short, the grasshopper played.|The grasshopper that saw the ant played; again, the grasshopper played.|The grasshopper that saw the ant played; I repeat, the grasshopper played.	The grasshopper that saw the ant played. Thus, the ant saw the grasshopper.|The grasshopper that saw the ant played. That is, the ant saw the grasshopper.|The grasshopper that saw the ant played. Therefore, the ant saw the grasshopper.|The grasshopper that saw the ant played. In short, the ant saw the grasshopper.|The grasshopper that saw the ant played. Again, the ant saw the grasshopper.|The grasshopper that saw the ant played. I repeat, the ant saw the grasshopper.|The grasshopper that saw the ant played; thus, the ant saw the grasshopper.|The grasshopper that saw the ant played; that is, the ant saw the grasshopper.|The grasshopper that saw the ant played; therefore, the ant saw the grasshopper.|The grasshopper that saw the ant played; in short, the ant saw the grasshopper.|The grasshopper that saw the ant played; again, the ant saw the grasshopper.|The grasshopper that saw the ant played; I repeat, the ant saw the grasshopper.|The grasshopper that saw the ant played. Thus, the ant saw the grasshopper.|The grasshopper that saw the ant played. That is, the ant saw the grasshopper.|The grasshopper that saw the ant played. Therefore, the ant saw the grasshopper.|The grasshopper that saw the ant played. In short, the ant saw the grasshopper.|The grasshopper that saw the ant played. Again, the ant saw the grasshopper.|The grasshopper that saw the ant played. I repeat, the ant saw the grasshopper.|The grasshopper that saw the ant played; thus, the ant saw the grasshopper.|The grasshopper that saw the ant played; that is, the ant saw the grasshopper.|The grasshopper that saw the ant played; therefore, the ant saw the grasshopper.|The grasshopper that saw the ant played; in short, the ant saw the grasshopper.|The grasshopper that saw the ant played; again, the ant saw the grasshopper.|The grasshopper that saw the ant played; I repeat, the ant saw the grasshopper.	The grasshopper that saw the ant played. Thus, the ant played.|The grasshopper that saw the ant played. That is, the ant played.|The grasshopper that saw the ant played. Therefore, the ant played.|The grasshopper that saw the ant played. In short, the ant played.|The grasshopper that saw the ant played. Again, the ant played.|The grasshopper that saw the ant played. I repeat, the ant played.|The grasshopper that saw the ant played; thus, the ant played.|The grasshopper that saw the ant played; that is, the ant played.|The grasshopper that saw the ant played; therefore, the ant played.|The grasshopper that saw the ant played; in short, the ant played.|The grasshopper that saw the ant played; again, the ant played.|The grasshopper that saw the ant played; I repeat, the ant played.|The grasshopper that saw the ant played. Thus, the ant played.|The grasshopper that saw the ant played. That is, the ant played.|The grasshopper that saw the ant played. Therefore, the ant played.|The grasshopper that saw the ant played. In short, the ant played.|The grasshopper that saw the ant played. Again, the ant played.|The grasshopper that saw the ant played. I repeat, the ant played.|The grasshopper that saw the ant played; thus, the ant played.|The grasshopper that saw the ant played; that is, the ant played.|The grasshopper that saw the ant played; therefore, the ant played.|The grasshopper that saw the ant played; in short, the ant played.|The grasshopper that saw the ant played; again, the ant played.|The grasshopper that saw the ant played; I repeat, the ant played.
The princess that angered the witch melted. Thus, the princess angered the witch.|The princess that angered the witch melted. That is, the princess angered the witch.|The princess that angered the witch melted. Therefore, the princess angered the witch.|The princess that angered the witch melted. In short, the princess angered the witch.|The princess that angered the witch melted. Again, the princess angered the witch.|The princess that angered the witch melted. I repeat, the princess angered the witch.|The princess that angered the witch melted; thus, the princess angered the witch.|The princess that angered the witch melted; that is, the princess angered the witch.|The princess that angered the witch melted; therefore, the princess angered the witch.|The princess that angered the witch melted; in short, the princess angered the witch.|The princess that angered the witch melted; again, the princess angered the witch.|The princess that angered the witch melted; I repeat, the princess angered the witch.|The princess that angered the witch melted. Thus, the princess angered the witch.|The princess that angered the witch melted. That is, the princess angered the witch.|The princess that angered the witch melted. Therefore, the princess angered the witch.|The princess that angered the witch melted. In short, the princess angered the witch.|The princess that angered the witch melted. Again, the princess angered the witch.|The princess that angered the witch melted. I repeat, the princess angered the witch.|The princess that angered the witch melted; thus, the princess angered the witch.|The princess that angered the witch melted; that is, the princess angered the witch.|The princess that angered the witch melted; therefore, the princess angered the witch.|The princess that angered the witch melted; in short, the princess angered the witch.|The princess that angered the witch melted; again, the princess angered the witch.|The princess that angered the witch melted; I repeat, the princess angered the witch.	The princess that angered the witch melted. Thus, the princess melted.|The princess that angered the witch melted. That is, the princess melted.|The princess that angered the witch melted. Therefore, the princess melted.|The princess that angered the witch melted. In short, the princess melted.|The princess that angered the witch melted. Again, the princess melted.|The princess that angered the witch melted. I repeat, the princess melted.|The princess that angered the witch melted; thus, the princess melted.|The princess that angered the witch melted; that is, the princess melted.|The princess that angered the witch melted; therefore, the princess melted.|The princess that angered the witch melted; in short, the princess melted.|The princess that angered the witch melted; again, the princess melted.|The princess that angered the witch melted; I repeat, the princess melted.|The princess that angered the witch melted. Thus, the princess melted.|The princess that angered the witch melted. That is, the princess melted.|The princess that angered the witch melted. Therefore, the princess melted.|The princess that angered the witch melted. In short, the princess melted.|The princess that angered the witch melted. Again, the princess melted.|The princess that angered the witch melted. I repeat, the princess melted.|The princess that angered the witch melted; thus, the princess melted.|The princess that angered the witch melted; that is, the princess melted.|The princess that angered the witch melted; therefore, the princess melted.|The princess that angered the witch melted; in short, the princess melted.|The princess that angered the witch melted; again, the princess melted.|The princess that angered the witch melted; I repeat, the princess melted.	The princess that angered the witch melted. Thus, the witch angered the princess.|The princess that angered the witch melted. That is, the witch angered the princess.|The princess that angered the witch melted. Therefore, the witch angered the princess.|The princess that angered the witch melted. In short, the witch angered the princess.|The princess that angered the witch melted. Again, the witch angered the princess.|The princess that angered the witch melted. I repeat, the witch angered the princess.|The princess that angered the witch melted; thus, the witch angered the princess.|The princess that angered the witch melted; that is, the witch angered the princess.|The princess that angered the witch melted; therefore, the witch angered the princess.|The princess that angered the witch melted; in short, the witch angered the princess.|The princess that angered the witch melted; again, the witch angered the princess.|The princess that angered the witch melted; I repeat, the witch angered the princess.|The princess that angered the witch melted. Thus, the witch angered the princess.|The princess that angered the witch melted. That is, the witch angered the princess.|The princess that angered the witch melted. Therefore, the witch angered the princess.|The princess that angered the witch melted. In short, the witch angered the princess.|The princess that angered the witch melted. Again, the witch angered the princess.|The princess that angered the witch melted. I repeat, the witch angered the princess.|The princess that angered the witch melted; thus, the witch angered the princess.|The princess that angered the witch melted; that is, the witch angered the princess.|The princess that angered the witch melted; therefore, the witch angered the princess.|The princess that angered the witch melted; in short, the witch angered the princess.|The princess that angered the witch melted; again, the witch angered the princess.|The princess that angered the witch melted; I repeat, the witch angered the princess.	The princess that angered the witch melted. Thus, the witch melted.|The princess that angered the witch melted. That is, the witch melted.|The princess that angered the witch melted. Therefore, the witch melted.|The princess that angered the witch melted. In short, the witch melted.|The princess that angered the witch melted. Again, the witch melted.|The princess that angered the witch melted. I repeat, the witch melted.|The princess that angered the witch melted; thus, the witch melted.|The princess that angered the witch melted; that is, the witch melted.|The princess that angered the witch melted; therefore, the witch melted.|The princess that angered the witch melted; in short, the witch melted.|The princess that angered the witch melted; again, the witch melted.|The princess that angered the witch melted; I repeat, the witch melted.|The princess that angered the witch melted. Thus, the witch melted.|The princess that angered the witch melted. That is, the witch melted.|The princess that angered the witch melted. Therefore, the witch melted.|The princess that angered the witch melted. In short, the witch melted.|The princess that angered the witch melted. Again, the witch melted.|The princess that angered the witch melted. I repeat, the witch melted.|The princess that angered the witch melted; thus, the witch melted.|The princess that angered the witch melted; that is, the witch melted.|The princess that angered the witch melted; therefore, the witch melted.|The princess that angered the witch melted; in short, the witch melted.|The princess that angered the witch melted; again, the witch melted.|The princess that angered the witch melted; I repeat, the witch melted.
The witch that angered the princess melted. Thus, the witch angered the princess.|The witch that angered the princess melted. That is, the witch angered the princess.|The witch that angered the princess melted. Therefore, the witch angered the princess.|The witch that angered the princess melted. In short, the witch angered the princess.|The witch that angered the princess melted. Again, the witch angered the princess.|The witch that angered the princess melted. I repeat, the witch angered the princess.|The witch that angered the princess melted; thus, the witch angered the princess.|The witch that angered the princess melted; that is, the witch angered the princess.|The witch that angered the princess melted; therefore, the witch angered the princess.|The witch that angered the princess melted; in short, the witch angered the princess.|The witch that angered the princess melted; again, the witch angered the princess.|The witch that angered the princess melted; I repeat, the witch angered the princess.|The witch that angered the princess melted. Thus, the witch angered the princess.|The witch that angered the princess melted. That is, the witch angered the princess.|The witch that angered the princess melted. Therefore, the witch angered the princess.|The witch that angered the princess melted. In short, the witch angered the princess.|The witch that angered the princess melted. Again, the witch angered the princess.|The witch that angered the princess melted. I repeat, the witch angered the princess.|The witch that angered the princess melted; thus, the witch angered the princess.|The witch that angered the princess melted; that is, the witch angered the princess.|The witch that angered the princess melted; therefore, the witch angered the princess.|The witch that angered the princess melted; in short, the witch angered the princess.|The witch that angered the princess melted; again, the witch angered the princess.|The witch that angered the princess melted; I repeat, the witch angered the princess.	The witch that angered the princess melted. Thus, the witch melted.|The witch that angered the princess melted. That is, the witch melted.|The witch that angered the princess melted. Therefore, the witch melted.|The witch that angered the princess melted. In short, the witch melted.|The witch that angered the princess melted. Again, the witch melted.|The witch that angered the princess melted. I repeat, the witch melted.|The witch that angered the princess melted; thus, the witch melted.|The witch that angered the princess melted; that is, the witch melted.|The witch that angered the princess melted; therefore, the witch melted.|The witch that angered the princess melted; in short, the witch melted.|The witch that angered the princess melted; again, the witch melted.|The witch that angered the princess melted; I repeat, the witch melted.|The witch that angered the princess melted. Thus, the witch melted.|The witch that angered the princess melted. That is, the witch melted.|The witch that angered the princess melted. Therefore, the witch melted.|The witch that angered the princess melted. In short, the witch melted.|The witch that angered the princess melted. Again, the witch melted.|The witch that angered the princess melted. I repeat, the witch melted.|The witch that angered the princess melted; thus, the witch melted.|The witch that angered the princess melted; that is, the witch melted.|The witch that angered the princess melted; therefore, the witch melted.|The witch that angered the princess melted; in short, the witch melted.|The witch that angered the princess melted; again, the witch melted.|The witch that angered the princess melted; I repeat, the witch melted.	The witch that angered the princess melted. Thus, the princess angered the witch.|The witch that angered the princess melted. That is, the princess angered the witch.|The witch that angered the princess melted. Therefore, the princess angered the witch.|The witch that angered the princess melted. In short, the princess angered the witch.|The witch that angered the princess melted. Again, the princess angered the witch.|The witch that angered the princess melted. I repeat, the princess angered the witch.|The witch that angered the princess melted; thus, the princess angered the witch.|The witch that angered the princess melted; that is, the princess angered the witch.|The witch that angered the princess melted; therefore, the princess angered the witch.|The witch that angered the princess melted; in short, the princess angered the witch.|The witch that angered the princess melted; again, the princess angered the witch.|The witch that angered the princess melted; I repeat, the princess angered the witch.|The witch that angered the princess melted. Thus, the princess angered the witch.|The witch that angered the princess melted. That is, the princess angered the witch.|The witch that angered the princess melted. Therefore, the princess angered the witch.|The witch that angered the princess melted. In short, the princess angered the witch.|The witch that angered the princess melted. Again, the princess angered the witch.|The witch that angered the princess melted. I repeat, the princess angered the witch.|The witch that angered the princess melted; thus, the princess angered the witch.|The witch that angered the princess melted; that is, the princess angered the witch.|The witch that angered the princess melted; therefore, the princess angered the witch.|The witch that angered the princess melted; in short, the princess angered the witch.|The witch that angered the princess melted; again, the princess angered the witch.|The witch that angered the princess melted; I repeat, the princess angered the witch.	The witch that angered the princess melted. Thus, the princess melted.|The witch that angered the princess melted. That is, the princess melted.|The witch that angered the princess melted. Therefore, the princess melted.|The witch that angered the princess melted. In short, the princess melted.|The witch that angered the princess melted. Again, the princess melted.|The witch that angered the princess melted. I repeat, the princess melted.|The witch that angered the princess melted; thus, the princess melted.|The witch that angered the princess melted; that is, the princess melted.|The witch that angered the princess melted; therefore, the princess melted.|The witch that angered the princess melted; in short, the princess melted.|The witch that angered the princess melted; again, the princess melted.|The witch that angered the princess melted; I repeat, the princess melted.|The witch that angered the princess melted. Thus, the princess melted.|The witch that angered the princess melted. That is, the princess melted.|The witch that angered the princess melted. Therefore, the princess melted.|The witch that angered the princess melted. In short, the princess melted.|The witch that angered the princess melted. Again, the princess melted.|The witch that angered the princess melted. I repeat, the princess melted.|The witch that angered the princess melted; thus, the princess melted.|The witch that angered the princess melted; that is, the princess melted.|The witch that angered the princess melted; therefore, the princess melted.|The witch that angered the princess melted; in short, the princess melted.|The witch that angered the princess melted; again, the princess melted.|The witch that angered the princess melted; I repeat, the princess melted.
