E_nX	E_X	C_nX	C_X
The bunny that touched the magician observed. Thus, the bunny touched the magician.|The bunny that touched the magician observed. That is, the bunny touched the magician.|The bunny that touched the magician observed. Therefore, the bunny touched the magician.|The bunny that touched the magician observed. In short, the bunny touched the magician.|The bunny that touched the magician observed. Again, the bunny touched the magician.|The bunny that touched the magician observed. I repeat, the bunny touched the magician.|The bunny that touched the magician observed; thus, the bunny touched the magician.|The bunny that touched the magician observed; that is, the bunny touched the magician.|The bunny that touched the magician observed; therefore, the bunny touched the magician.|The bunny that touched the magician observed; in short, the bunny touched the magician.|The bunny that touched the magician observed; again, the bunny touched the magician.|The bunny that touched the magician observed; I repeat, the bunny touched the magician.|The bunny that touched the magician observed. Thus, the bunny touched the magician.|The bunny that touched the magician observed. That is, the bunny touched the magician.|The bunny that touched the magician observed. Therefore, the bunny touched the magician.|The bunny that touched the magician observed. In short, the bunny touched the magician.|The bunny that touched the magician observed. Again, the bunny touched the magician.|The bunny that touched the magician observed. I repeat, the bunny touched the magician.|The bunny that touched the magician observed; thus, the bunny touched the magician.|The bunny that touched the magician observed; that is, the bunny touched the magician.|The bunny that touched the magician observed; therefore, the bunny touched the magician.|The bunny that touched the magician observed; in short, the bunny touched the magician.|The bunny that touched the magician observed; again, the bunny touched the magician.|The bunny that touched the magician observed; I repeat, the bunny touched the magician.	The bunny that touched the magician observed. Thus, the bunny observed.|The bunny that touched the magician observed. That is, the bunny observed.|The bunny that touched the magician observed. Therefore, the bunny observed.|The bunny that touched the magician observed. In short, the bunny observed.|The bunny that touched the magician observed. Again, the bunny observed.|The bunny that touched the magician observed. I repeat, the bunny observed.|The bunny that touched the magician observed; thus, the bunny observed.|The bunny that touched the magician observed; that is, the bunny observed.|The bunny that touched the magician observed; therefore, the bunny observed.|The bunny that touched the magician observed; in short, the bunny observed.|The bunny that touched the magician observed; again, the bunny observed.|The bunny that touched the magician observed; I repeat, the bunny observed.|The bunny that touched the magician observed. Thus, the bunny observed.|The bunny that touched the magician observed. That is, the bunny observed.|The bunny that touched the magician observed. Therefore, the bunny observed.|The bunny that touched the magician observed. In short, the bunny observed.|The bunny that touched the magician observed. Again, the bunny observed.|The bunny that touched the magician observed. I repeat, the bunny observed.|The bunny that touched the magician observed; thus, the bunny observed.|The bunny that touched the magician observed; that is, the bunny observed.|The bunny that touched the magician observed; therefore, the bunny observed.|The bunny that touched the magician observed; in short, the bunny observed.|The bunny that touched the magician observed; again, the bunny observed.|The bunny that touched the magician observed; I repeat, the bunny observed.	The bunny that touched the magician observed. Thus, the magician touched the bunny.|The bunny that touched the magician observed. That is, the magician touched the bunny.|The bunny that touched the magician observed. Therefore, the magician touched the bunny.|The bunny that touched the magician observed. In short, the magician touched the bunny.|The bunny that touched the magician observed. Again, the magician touched the bunny.|The bunny that touched the magician observed. I repeat, the magician touched the bunny.|The bunny that touched the magician observed; thus, the magician touched the bunny.|The bunny that touched the magician observed; that is, the magician touched the bunny.|The bunny that touched the magician observed; therefore, the magician touched the bunny.|The bunny that touched the magician observed; in short, the magician touched the bunny.|The bunny that touched the magician observed; again, the magician touched the bunny.|The bunny that touched the magician observed; I repeat, the magician touched the bunny.|The bunny that touched the magician observed. Thus, the magician touched the bunny.|The bunny that touched the magician observed. That is, the magician touched the bunny.|The bunny that touched the magician observed. Therefore, the magician touched the bunny.|The bunny that touched the magician observed. In short, the magician touched the bunny.|The bunny that touched the magician observed. Again, the magician touched the bunny.|The bunny that touched the magician observed. I repeat, the magician touched the bunny.|The bunny that touched the magician observed; thus, the magician touched the bunny.|The bunny that touched the magician observed; that is, the magician touched the bunny.|The bunny that touched the magician observed; therefore, the magician touched the bunny.|The bunny that touched the magician observed; in short, the magician touched the bunny.|The bunny that touched the magician observed; again, the magician touched the bunny.|The bunny that touched the magician observed; I repeat, the magician touched the bunny.	The bunny that touched the magician observed. Thus, the magician observed.|The bunny that touched the magician observed. That is, the magician observed.|The bunny that touched the magician observed. Therefore, the magician observed.|The bunny that touched the magician observed. In short, the magician observed.|The bunny that touched the magician observed. Again, the magician observed.|The bunny that touched the magician observed. I repeat, the magician observed.|The bunny that touched the magician observed; thus, the magician observed.|The bunny that touched the magician observed; that is, the magician observed.|The bunny that touched the magician observed; therefore, the magician observed.|The bunny that touched the magician observed; in short, the magician observed.|The bunny that touched the magician observed; again, the magician observed.|The bunny that touched the magician observed; I repeat, the magician observed.|The bunny that touched the magician observed. Thus, the magician observed.|The bunny that touched the magician observed. That is, the magician observed.|The bunny that touched the magician observed. Therefore, the magician observed.|The bunny that touched the magician observed. In short, the magician observed.|The bunny that touched the magician observed. Again, the magician observed.|The bunny that touched the magician observed. I repeat, the magician observed.|The bunny that touched the magician observed; thus, the magician observed.|The bunny that touched the magician observed; that is, the magician observed.|The bunny that touched the magician observed; therefore, the magician observed.|The bunny that touched the magician observed; in short, the magician observed.|The bunny that touched the magician observed; again, the magician observed.|The bunny that touched the magician observed; I repeat, the magician observed.
The dragon that surprised the child apologized. Thus, the dragon surprised the child.|The dragon that surprised the child apologized. That is, the dragon surprised the child.|The dragon that surprised the child apologized. Therefore, the dragon surprised the child.|The dragon that surprised the child apologized. In short, the dragon surprised the child.|The dragon that surprised the child apologized. Again, the dragon surprised the child.|The dragon that surprised the child apologized. I repeat, the dragon surprised the child.|The dragon that surprised the child apologized; thus, the dragon surprised the child.|The dragon that surprised the child apologized; that is, the dragon surprised the child.|The dragon that surprised the child apologized; therefore, the dragon surprised the child.|The dragon that surprised the child apologized; in short, the dragon surprised the child.|The dragon that surprised the child apologized; again, the dragon surprised the child.|The dragon that surprised the child apologized; I repeat, the dragon surprised the child.|The dragon that surprised the child apologized. Thus, the dragon surprised the child.|The dragon that surprised the child apologized. That is, the dragon surprised the child.|The dragon that surprised the child apologized. Therefore, the dragon surprised the child.|The dragon that surprised the child apologized. In short, the dragon surprised the child.|The dragon that surprised the child apologized. Again, the dragon surprised the child.|The dragon that surprised the child apologized. I repeat, the dragon surprised the child.|The dragon that surprised the child apologized; thus, the dragon surprised the child.|The dragon that surprised the child apologized; that is, the dragon surprised the child.|The dragon that surprised the child apologized; therefore, the dragon surprised the child.|The dragon that surprised the child apologized; in short, the dragon surprised the child.|The dragon that surprised the child apologized; again, the dragon surprised the child.|The dragon that surprised the child apologized; I repeat, the dragon surprised the child.	The dragon that surprised the child apologized. Thus, the dragon apologized.|The dragon that surprised the child apologized. That is, the dragon apologized.|The dragon that surprised the child apologized. Therefore, the dragon apologized.|The dragon that surprised the child apologized. In short, the dragon apologized.|The dragon that surprised the child apologized. Again, the dragon apologized.|The dragon that surprised the child apologized. I repeat, the dragon apologized.|The dragon that surprised the child apologized; thus, the dragon apologized.|The dragon that surprised the child apologized; that is, the dragon apologized.|The dragon that surprised the child apologized; therefore, the dragon apologized.|The dragon that surprised the child apologized; in short, the dragon apologized.|The dragon that surprised the child apologized; again, the dragon apologized.|The dragon that surprised the child apologized; I repeat, the dragon apologized.|The dragon that surprised the child apologized. Thus, the dragon apologized.|The dragon that surprised the child apologized. That is, the dragon apologized.|The dragon that surprised the child apologized. Therefore, the dragon apologized.|The dragon that surprised the child apologized. In short, the dragon apologized.|The dragon that surprised the child apologized. Again, the dragon apologized.|The dragon that surprised the child apologized. I repeat, the dragon apologized.|The dragon that surprised the child apologized; thus, the dragon apologized.|The dragon that surprised the child apologized; that is, the dragon apologized.|The dragon that surprised the child apologized; therefore, the dragon apologized.|The dragon that surprised the child apologized; in short, the dragon apologized.|The dragon that surprised the child apologized; again, the dragon apologized.|The dragon that surprised the child apologized; I repeat, the dragon apologized.	The dragon that surprised the child apologized. Thus, the child surprised the dragon.|The dragon that surprised the child apologized. That is, the child surprised the dragon.|The dragon that surprised the child apologized. Therefore, the child surprised the dragon.|The dragon that surprised the child apologized. In short, the child surprised the dragon.|The dragon that surprised the child apologized. Again, the child surprised the dragon.|The dragon that surprised the child apologized. I repeat, the child surprised the dragon.|The dragon that surprised the child apologized; thus, the child surprised the dragon.|The dragon that surprised the child apologized; that is, the child surprised the dragon.|The dragon that surprised the child apologized; therefore, the child surprised the dragon.|The dragon that surprised the child apologized; in short, the child surprised the dragon.|The dragon that surprised the child apologized; again, the child surprised the dragon.|The dragon that surprised the child apologized; I repeat, the child surprised the dragon.|The dragon that surprised the child apologized. Thus, the child surprised the dragon.|The dragon that surprised the child apologized. That is, the child surprised the dragon.|The dragon that surprised the child apologized. Therefore, the child surprised the dragon.|The dragon that surprised the child apologized. In short, the child surprised the dragon.|The dragon that surprised the child apologized. Again, the child surprised the dragon.|The dragon that surprised the child apologized. I repeat, the child surprised the dragon.|The dragon that surprised the child apologized; thus, the child surprised the dragon.|The dragon that surprised the child apologized; that is, the child surprised the dragon.|The dragon that surprised the child apologized; therefore, the child surprised the dragon.|The dragon that surprised the child apologized; in short, the child surprised the dragon.|The dragon that surprised the child apologized; again, the child surprised the dragon.|The dragon that surprised the child apologized; I repeat, the child surprised the dragon.	The dragon that surprised the child apologized. Thus, the child apologized.|The dragon that surprised the child apologized. That is, the child apologized.|The dragon that surprised the child apologized. Therefore, the child apologized.|The dragon that surprised the child apologized. In short, the child apologized.|The dragon that surprised the child apologized. Again, the child apologized.|The dragon that surprised the child apologized. I repeat, the child apologized.|The dragon that surprised the child apologized; thus, the child apologized.|The dragon that surprised the child apologized; that is, the child apologized.|The dragon that surprised the child apologized; therefore, the child apologized.|The dragon that surprised the child apologized; in short, the child apologized.|The dragon that surprised the child apologized; again, the child apologized.|The dragon that surprised the child apologized; I repeat, the child apologized.|The dragon that surprised the child apologized. Thus, the child apologized.|The dragon that surprised the child apologized. That is, the child apologized.|The dragon that surprised the child apologized. Therefore, the child apologized.|The dragon that surprised the child apologized. In short, the child apologized.|The dragon that surprised the child apologized. Again, the child apologized.|The dragon that surprised the child apologized. I repeat, the child apologized.|The dragon that surprised the child apologized; thus, the child apologized.|The dragon that surprised the child apologized; that is, the child apologized.|The dragon that surprised the child apologized; therefore, the child apologized.|The dragon that surprised the child apologized; in short, the child apologized.|The dragon that surprised the child apologized; again, the child apologized.|The dragon that surprised the child apologized; I repeat, the child apologized.
The child that surprised the dragon apologized. Thus, the child surprised the dragon.|The child that surprised the dragon apologized. That is, the child surprised the dragon.|The child that surprised the dragon apologized. Therefore, the child surprised the dragon.|The child that surprised the dragon apologized. In short, the child surprised the dragon.|The child that surprised the dragon apologized. Again, the child surprised the dragon.|The child that surprised the dragon apologized. I repeat, the child surprised the dragon.|The child that surprised the dragon apologized; thus, the child surprised the dragon.|The child that surprised the dragon apologized; that is, the child surprised the dragon.|The child that surprised the dragon apologized; therefore, the child surprised the dragon.|The child that surprised the dragon apologized; in short, the child surprised the dragon.|The child that surprised the dragon apologized; again, the child surprised the dragon.|The child that surprised the dragon apologized; I repeat, the child surprised the dragon.|The child that surprised the dragon apologized. Thus, the child surprised the dragon.|The child that surprised the dragon apologized. That is, the child surprised the dragon.|The child that surprised the dragon apologized. Therefore, the child surprised the dragon.|The child that surprised the dragon apologized. In short, the child surprised the dragon.|The child that surprised the dragon apologized. Again, the child surprised the dragon.|The child that surprised the dragon apologized. I repeat, the child surprised the dragon.|The child that surprised the dragon apologized; thus, the child surprised the dragon.|The child that surprised the dragon apologized; that is, the child surprised the dragon.|The child that surprised the dragon apologized; therefore, the child surprised the dragon.|The child that surprised the dragon apologized; in short, the child surprised the dragon.|The child that surprised the dragon apologized; again, the child surprised the dragon.|The child that surprised the dragon apologized; I repeat, the child surprised the dragon.	The child that surprised the dragon apologized. Thus, the child apologized.|The child that surprised the dragon apologized. That is, the child apologized.|The child that surprised the dragon apologized. Therefore, the child apologized.|The child that surprised the dragon apologized. In short, the child apologized.|The child that surprised the dragon apologized. Again, the child apologized.|The child that surprised the dragon apologized. I repeat, the child apologized.|The child that surprised the dragon apologized; thus, the child apologized.|The child that surprised the dragon apologized; that is, the child apologized.|The child that surprised the dragon apologized; therefore, the child apologized.|The child that surprised the dragon apologized; in short, the child apologized.|The child that surprised the dragon apologized; again, the child apologized.|The child that surprised the dragon apologized; I repeat, the child apologized.|The child that surprised the dragon apologized. Thus, the child apologized.|The child that surprised the dragon apologized. That is, the child apologized.|The child that surprised the dragon apologized. Therefore, the child apologized.|The child that surprised the dragon apologized. In short, the child apologized.|The child that surprised the dragon apologized. Again, the child apologized.|The child that surprised the dragon apologized. I repeat, the child apologized.|The child that surprised the dragon apologized; thus, the child apologized.|The child that surprised the dragon apologized; that is, the child apologized.|The child that surprised the dragon apologized; therefore, the child apologized.|The child that surprised the dragon apologized; in short, the child apologized.|The child that surprised the dragon apologized; again, the child apologized.|The child that surprised the dragon apologized; I repeat, the child apologized.	The child that surprised the dragon apologized. Thus, the dragon surprised the child.|The child that surprised the dragon apologized. That is, the dragon surprised the child.|The child that surprised the dragon apologized. Therefore, the dragon surprised the child.|The child that surprised the dragon apologized. In short, the dragon surprised the child.|The child that surprised the dragon apologized. Again, the dragon surprised the child.|The child that surprised the dragon apologized. I repeat, the dragon surprised the child.|The child that surprised the dragon apologized; thus, the dragon surprised the child.|The child that surprised the dragon apologized; that is, the dragon surprised the child.|The child that surprised the dragon apologized; therefore, the dragon surprised the child.|The child that surprised the dragon apologized; in short, the dragon surprised the child.|The child that surprised the dragon apologized; again, the dragon surprised the child.|The child that surprised the dragon apologized; I repeat, the dragon surprised the child.|The child that surprised the dragon apologized. Thus, the dragon surprised the child.|The child that surprised the dragon apologized. That is, the dragon surprised the child.|The child that surprised the dragon apologized. Therefore, the dragon surprised the child.|The child that surprised the dragon apologized. In short, the dragon surprised the child.|The child that surprised the dragon apologized. Again, the dragon surprised the child.|The child that surprised the dragon apologized. I repeat, the dragon surprised the child.|The child that surprised the dragon apologized; thus, the dragon surprised the child.|The child that surprised the dragon apologized; that is, the dragon surprised the child.|The child that surprised the dragon apologized; therefore, the dragon surprised the child.|The child that surprised the dragon apologized; in short, the dragon surprised the child.|The child that surprised the dragon apologized; again, the dragon surprised the child.|The child that surprised the dragon apologized; I repeat, the dragon surprised the child.	The child that surprised the dragon apologized. Thus, the dragon apologized.|The child that surprised the dragon apologized. That is, the dragon apologized.|The child that surprised the dragon apologized. Therefore, the dragon apologized.|The child that surprised the dragon apologized. In short, the dragon apologized.|The child that surprised the dragon apologized. Again, the dragon apologized.|The child that surprised the dragon apologized. I repeat, the dragon apologized.|The child that surprised the dragon apologized; thus, the dragon apologized.|The child that surprised the dragon apologized; that is, the dragon apologized.|The child that surprised the dragon apologized; therefore, the dragon apologized.|The child that surprised the dragon apologized; in short, the dragon apologized.|The child that surprised the dragon apologized; again, the dragon apologized.|The child that surprised the dragon apologized; I repeat, the dragon apologized.|The child that surprised the dragon apologized. Thus, the dragon apologized.|The child that surprised the dragon apologized. That is, the dragon apologized.|The child that surprised the dragon apologized. Therefore, the dragon apologized.|The child that surprised the dragon apologized. In short, the dragon apologized.|The child that surprised the dragon apologized. Again, the dragon apologized.|The child that surprised the dragon apologized. I repeat, the dragon apologized.|The child that surprised the dragon apologized; thus, the dragon apologized.|The child that surprised the dragon apologized; that is, the dragon apologized.|The child that surprised the dragon apologized; therefore, the dragon apologized.|The child that surprised the dragon apologized; in short, the dragon apologized.|The child that surprised the dragon apologized; again, the dragon apologized.|The child that surprised the dragon apologized; I repeat, the dragon apologized.
